"ProductId","CategoryId","ProductName","ProductDescription","ProductPrice","ProductQuantity"
"23306",1,"SET OF 36 PANTRY PAPER DOILIES","SET OF 36 PANTRY PAPER DOILIES","1.45",100000
"23307",1,"SET OF 60 PANTRY DESIGN CAKE CASES ","SET OF 60 PANTRY DESIGN CAKE CASES ","0.55",100000
"23308",1,"SET OF 60 VINTAGE LEAF CAKE CASES ","SET OF 60 VINTAGE LEAF CAKE CASES ","0.55",100000
"23309",1,"SET OF 60 I LOVE LONDON CAKE CASES ","SET OF 60 I LOVE LONDON CAKE CASES ","1.25",100000
"23310",1,"BUBBLEGUM RING ASSORTED","BUBBLEGUM RING ASSORTED","0.83",100000
"23311",1,"VINTAGE CHRISTMAS STOCKING ","VINTAGE CHRISTMAS STOCKING ","2.55",100000
"23312",1,"VINTAGE CHRISTMAS GIFT SACK","VINTAGE CHRISTMAS GIFT SACK","4.15",100000
"23313",1,"VINTAGE CHRISTMAS BUNTING","VINTAGE CHRISTMAS BUNTING","4.95",100000
"23314",1,"VINTAGE CHRISTMAS TABLECLOTH","VINTAGE CHRISTMAS TABLECLOTH","12.50",100000
"23315",1,"IVORY REFECTORY CLOCK","IVORY REFECTORY CLOCK","9.95",100000
"23316",1,"RED REFECTORY CLOCK ","RED REFECTORY CLOCK ","9.95",100000
"23317",1,"BLUE REFECTORY CLOCK ","BLUE REFECTORY CLOCK ","9.95",100000
"23318",1,"BOX OF 6 MINI VINTAGE CRACKERS","BOX OF 6 MINI VINTAGE CRACKERS","4.96",100000
"23319",1,"BOX OF 6 MINI 50'S CRACKERS","BOX OF 6 MINI 50'S CRACKERS","4.96",100000
"23320",1,"GIANT 50'S CHRISTMAS CRACKER","GIANT 50'S CHRISTMAS CRACKER","1.25",100000
"23321",1,"SMALL WHITE HEART OF WICKER","SMALL WHITE HEART OF WICKER","1.65",100000
"23322",1,"LARGE WHITE HEART OF WICKER","LARGE WHITE HEART OF WICKER","2.95",100000
"23323",1,"WHITE WICKER STAR ","WHITE WICKER STAR ","2.10",100000
"23324",1,"RUSTIC STRAWBERRY JAM POT LARGE ","RUSTIC STRAWBERRY JAM POT LARGE ","2.08",100000
"23325",1,"RUSTIC STRAWBERRY JAM POT SMALL","RUSTIC STRAWBERRY JAM POT SMALL","1.65",100000
"23326",1,"HANGING MINI COLOURED BOTTLES","HANGING MINI COLOURED BOTTLES","0.52",100000
"23327",1,"HANGING CLEAR MINI BOTTLE","HANGING CLEAR MINI BOTTLE","0.63",100000
"23328",1,"SET 6 SCHOOL MILK BOTTLES IN CRATE","SET 6 SCHOOL MILK BOTTLES IN CRATE","3.75",100000
"23329",1,"DECORATIVE WICKER HEART LARGE","DECORATIVE WICKER HEART LARGE","1.65",100000
"23330",1,"DECORATIVE WICKER HEART MEDIUM","DECORATIVE WICKER HEART MEDIUM","1.25",100000
"23331",1,"DECORATIVE WICKER HEART SMALL","DECORATIVE WICKER HEART SMALL","0.63",100000
"23332",1,"IVORY WICKER HEART LARGE","IVORY WICKER HEART LARGE","1.65",100000
"23333",1,"IVORY WICKER HEART MEDIUM","IVORY WICKER HEART MEDIUM","1.25",100000
"23334",1,"IVORY WICKER HEART SMALL","IVORY WICKER HEART SMALL","1.25",100000
"23335",1,"EGG FRYING PAN IVORY ","EGG FRYING PAN IVORY ","2.08",100000
"23336",1,"EGG FRYING PAN PINK ","EGG FRYING PAN PINK ","2.08",100000
"23337",1,"EGG FRYING PAN MINT ","EGG FRYING PAN MINT ","2.08",100000
"23338",1,"EGG FRYING PAN RED ","EGG FRYING PAN RED ","2.08",100000
"23339",1,"EGG FRYING PAN BLUE ","EGG FRYING PAN BLUE ","2.08",100000
"23340",1,"VINTAGE CHRISTMAS CAKE FRILL","VINTAGE CHRISTMAS CAKE FRILL","1.65",100000
"23341",1,"PINK DINER WALL CLOCK","PINK DINER WALL CLOCK","8.50",100000
"23342",1,"MINT DINER WALL CLOCK","MINT DINER WALL CLOCK","8.50",100000
"23343",1,"JUMBO BAG VINTAGE CHRISTMAS ","JUMBO BAG VINTAGE CHRISTMAS ","2.46",100000
"23344",1,"JUMBO BAG 50'S CHRISTMAS ","JUMBO BAG 50'S CHRISTMAS ","4.13",100000
"23345",1," DOLLY GIRL BEAKER"," DOLLY GIRL BEAKER","1.25",100000
"23346",1,"SPACEBOY BEAKER","SPACEBOY BEAKER","1.25",100000
"23347",1,"I LOVE LONDON BEAKER","I LOVE LONDON BEAKER","2.46",100000
"23348",1,"CHILDRENS TOY COOKING UTENSIL SET","CHILDRENS TOY COOKING UTENSIL SET","2.08",100000
"23349",1,"ROLL WRAP VINTAGE CHRISTMAS","ROLL WRAP VINTAGE CHRISTMAS","1.25",100000
"23350",1,"ROLL WRAP VINTAGE SPOT ","ROLL WRAP VINTAGE SPOT ","1.25",100000
"23351",1,"ROLL WRAP 50'S CHRISTMAS","ROLL WRAP 50'S CHRISTMAS","1.25",100000
"23352",1,"ROLL WRAP 50'S RED CHRISTMAS ","ROLL WRAP 50'S RED CHRISTMAS ","1.25",100000
"23353",1,"6 GIFT TAGS VINTAGE CHRISTMAS ","6 GIFT TAGS VINTAGE CHRISTMAS ","0.83",100000
"23354",1,"6 GIFT TAGS 50'S CHRISTMAS ","6 GIFT TAGS 50'S CHRISTMAS ","0.83",100000
"23355",1,"HOT WATER BOTTLE KEEP CALM","HOT WATER BOTTLE KEEP CALM","4.95",100000
"23356",1,"LOVE HOT WATER BOTTLE","LOVE HOT WATER BOTTLE","5.95",100000
"23357",1,"HOT WATER BOTTLE SEX BOMB","HOT WATER BOTTLE SEX BOMB","1.65",100000
"23358",1,"HOT STUFF HOT WATER BOTTLE","HOT STUFF HOT WATER BOTTLE","7.46",100000
"23359",1,"SET OF 12 T-LIGHTS VINTAGE DOILY","SET OF 12 T-LIGHTS VINTAGE DOILY","1.95",100000
"23360",1,"SET 8 CANDLES VINTAGE DOILY","SET 8 CANDLES VINTAGE DOILY","4.13",100000
"23365",1,"SET 12 COLOUR PENCILS LOVE LONDON","SET 12 COLOUR PENCILS LOVE LONDON","0.65",100000
"23366",1,"SET 12 COLOURING PENCILS DOILY","SET 12 COLOURING PENCILS DOILY","1.25",100000
"23367",1,"SET 12 COLOUR PENCILS SPACEBOY ","SET 12 COLOUR PENCILS SPACEBOY ","0.65",100000
"23368",1,"SET 12 COLOUR PENCILS DOLLY GIRL ","SET 12 COLOUR PENCILS DOLLY GIRL ","0.65",100000
"23369",1,"SET 36 COLOUR PENCILS LOVE LONDON","SET 36 COLOUR PENCILS LOVE LONDON","1.25",100000
"23370",1,"SET 36 COLOURING PENCILS DOILY","SET 36 COLOURING PENCILS DOILY","1.25",100000
"23371",1,"SET 36 COLOUR PENCILS SPACEBOY ","SET 36 COLOUR PENCILS SPACEBOY ","1.25",100000
"23372",1,"SET 36 COLOUR PENCILS DOLLY GIRL","SET 36 COLOUR PENCILS DOLLY GIRL","1.25",100000
"23373",1,"VINTAGE CHRISTMAS PAPER GIFT BAG","VINTAGE CHRISTMAS PAPER GIFT BAG","0.82",100000
"23374",1,"RED SPOT PAPER GIFT BAG","RED SPOT PAPER GIFT BAG","0.82",100000
"23375",1,"50'S CHRISTMAS PAPER GIFT BAG","50'S CHRISTMAS PAPER GIFT BAG","1.63",100000
"23376",1,"PACK OF 12 VINTAGE CHRISTMAS TISSUE","PACK OF 12 VINTAGE CHRISTMAS TISSUE","0.39",100000
"23377",1,"PACK OF 12 DOLLY GIRL TISSUES","PACK OF 12 DOLLY GIRL TISSUES","0.83",100000
"23378",1,"PACK OF 12 50'S CHRISTMAS TISSUES","PACK OF 12 50'S CHRISTMAS TISSUES","0.83",100000
"23379",1,"PACK OF 12 RED APPLE TISSUES","PACK OF 12 RED APPLE TISSUES","0.83",100000
"23380",1,"PACK OF 12 VINTAGE DOILY TISSUES","PACK OF 12 VINTAGE DOILY TISSUES","0.83",100000
"23381",1,"PACK OF 12 VINTAGE LEAF TISSUES ","PACK OF 12 VINTAGE LEAF TISSUES ","0.83",100000
"23382",1,"BOX OF 6 CHRISTMAS CAKE DECORATIONS","BOX OF 6 CHRISTMAS CAKE DECORATIONS","3.75",100000
"23388",1,"WOODLAND MINI BACKPACK","WOODLAND MINI BACKPACK","4.15",100000
"23389",1,"SPACEBOY MINI BACKPACK","SPACEBOY MINI BACKPACK","4.15",100000
"23390",1,"DOLLY GIRL MINI BACKPACK","DOLLY GIRL MINI BACKPACK","4.15",100000
"23391",1," I LOVE LONDON MINI BACKPACK"," I LOVE LONDON MINI BACKPACK","4.15",100000
"23392",1,"SPACEBOY ROCKET LOLLY MAKERS","SPACEBOY ROCKET LOLLY MAKERS","4.13",100000
"23393",1,"HOME SWEET HOME CUSHION COVER ","HOME SWEET HOME CUSHION COVER ","3.75",100000
"23394",1,"POSTE FRANCE CUSHION COVER","POSTE FRANCE CUSHION COVER","3.75",100000
"23395",1,"BELLE JARDINIERE CUSHION COVER","BELLE JARDINIERE CUSHION COVER","3.75",100000
"23396",1,"LE JARDIN BOTANIQUE CUSHION COVER","LE JARDIN BOTANIQUE CUSHION COVER","4.58",100000
"23397",1,"FOOT STOOL HOME SWEET HOME ","FOOT STOOL HOME SWEET HOME ","9.96",100000
"23398",1,"HANGING HEART BONHEUR","HANGING HEART BONHEUR","0.85",100000
"23399",1,"HOME SWEET HOME HANGING HEART","HOME SWEET HOME HANGING HEART","0.85",100000
"23400",1,"SHELF WITH 4 HOOKS HOME SWEET HOME","SHELF WITH 4 HOOKS HOME SWEET HOME","12.46",100000
"23401",1,"RUSTIC MIRROR WITH LACE HEART","RUSTIC MIRROR WITH LACE HEART","12.46",100000
"23402",1,"HOME SWEET HOME 3 PEG HANGER ","HOME SWEET HOME 3 PEG HANGER ","3.75",100000
"23403",1,"LETTER HOLDER HOME SWEET HOME","LETTER HOLDER HOME SWEET HOME","3.75",100000
"23404",1,"HOME SWEET HOME BLACKBOARD","HOME SWEET HOME BLACKBOARD","4.95",100000
"23405",1,"HOME SWEET HOME 2 DRAWER CABINET","HOME SWEET HOME 2 DRAWER CABINET","4.95",100000
"23406",1,"HOME SWEET HOME KEY HOLDER","HOME SWEET HOME KEY HOLDER","6.25",100000
"23407",1,"SET OF 2 TRAYS HOME SWEET HOME","SET OF 2 TRAYS HOME SWEET HOME","9.95",100000
"23408",1,"PHOTO FRAME LINEN AND LACE SMALL","PHOTO FRAME LINEN AND LACE SMALL","2.08",100000
"23409",1,"PHOTO FRAME LINEN AND LACE LARGE","PHOTO FRAME LINEN AND LACE LARGE","3.75",100000
"23410",1,"CURIO CABINET LINEN AND LACE ","CURIO CABINET LINEN AND LACE ","8.15",100000
"23411",1," TRELLIS COAT RACK"," TRELLIS COAT RACK","4.95",100000
"23412",1,"HEART MIRROR ANTIQUE WHITE","HEART MIRROR ANTIQUE WHITE","0.00",100000
"23413",1,"DECORATIVE VINTAGE COFFEE  BOX","DECORATIVE VINTAGE COFFEE  BOX","4.95",100000
"23414",1,"ZINC BOX SIGN HOME","ZINC BOX SIGN HOME","9.95",100000
"23415",1,"HOME SWEET HOME HOOK","HOME SWEET HOME HOOK","1.65",100000
"23416",1,"CHAMBRE HOOK","CHAMBRE HOOK","3.29",100000
"23417",1,"BATHROOM HOOK","BATHROOM HOOK","3.29",100000
"23418",1,"LAVENDER TOILETTE BOTTLE","LAVENDER TOILETTE BOTTLE","2.08",100000
"23419",1,"HOME SWEET HOME BOTTLE ","HOME SWEET HOME BOTTLE ","2.08",100000
"23420",1,"PANTRY HOOK TEA STRAINER ","PANTRY HOOK TEA STRAINER ","2.08",100000
"23421",1,"PANTRY HOOK SPATULA","PANTRY HOOK SPATULA","2.08",100000
"23422",1,"PANTRY HOOK BALLOON WHISK ","PANTRY HOOK BALLOON WHISK ","4.13",100000
"23423",1,"PANTRY 3 HOOK ROLLING PIN HANGER","PANTRY 3 HOOK ROLLING PIN HANGER","3.75",100000
"23424",1,"GINGHAM RECIPE BOOK BOX","GINGHAM RECIPE BOOK BOX","4.95",100000
"23425",1,"STORAGE TIN HOME SWEET HOME","STORAGE TIN HOME SWEET HOME","4.96",100000
"23426",1,"METAL SIGN DROP YOUR PANTS","METAL SIGN DROP YOUR PANTS","2.89",100000
"23427",1,"STOOL HOME SWEET HOME ","STOOL HOME SWEET HOME ","12.50",100000
"23428",1,"IVORY RETRO KITCHEN WALL CLOCK","IVORY RETRO KITCHEN WALL CLOCK","8.15",100000
"23429",1,"RED RETRO KITCHEN WALL CLOCK","RED RETRO KITCHEN WALL CLOCK","8.15",100000
"23430",1,"BLUE RETRO KITCHEN WALL CLOCK","BLUE RETRO KITCHEN WALL CLOCK","8.15",100000
"23431",1,"NATURAL HANGING QUILTED HEARTS ","NATURAL HANGING QUILTED HEARTS ","0.83",100000
"23432",1,"PRETTY HANGING QUILTED HEARTS","PRETTY HANGING QUILTED HEARTS","0.83",100000
"23433",1,"HANGING QUILTED PATCHWORK APPLES","HANGING QUILTED PATCHWORK APPLES","0.83",100000
"23434",1,"3 RAFFIA RIBBONS 50'S CHRISTMAS ","3 RAFFIA RIBBONS 50'S CHRISTMAS ","0.79",100000
"23435",1,"3 RAFFIA RIBBONS VINTAGE CHRISTMAS","3 RAFFIA RIBBONS VINTAGE CHRISTMAS","0.83",100000
"23436",1,"VINTAGE CHRISTMAS GIFT BAG LARGE ","VINTAGE CHRISTMAS GIFT BAG LARGE ","2.46",100000
"23437",1," 50'S CHRISTMAS GIFT BAG LARGE"," 50'S CHRISTMAS GIFT BAG LARGE","2.46",100000
"23438",1," RED SPOT GIFT BAG LARGE"," RED SPOT GIFT BAG LARGE","1.25",100000
"23439",1,"HAND WARMER RED LOVE HEART","HAND WARMER RED LOVE HEART","2.10",100000
"23440",1,"PAINT YOUR OWN EGGS IN CRATE","PAINT YOUR OWN EGGS IN CRATE","2.08",100000
"23441",1,"HAND PAINTED HANGING EASTER EGG","HAND PAINTED HANGING EASTER EGG","0.42",100000
"23442",1,"12 HANGING EGGS HAND PAINTED","12 HANGING EGGS HAND PAINTED","2.08",100000
"23444",1,"Next Day Carriage","Next Day Carriage","15.00",100000
"23445",1,"ICE CREAM BUBBLES","ICE CREAM BUBBLES","0.83",100000
"23446",1,"BLUE BUNNY EASTER EGG BASKET","BLUE BUNNY EASTER EGG BASKET","1.65",100000
"23447",1,"PINK BUNNY EASTER EGG BASKET","PINK BUNNY EASTER EGG BASKET","1.65",100000
"23448",1,"CREAM BUNNY EASTER EGG BASKET","CREAM BUNNY EASTER EGG BASKET","1.65",100000
"23449",1,"SET OF 6 EASTER RAINBOW CHICKS","SET OF 6 EASTER RAINBOW CHICKS","1.25",100000
"23451",1,"SQUARE MINI PORTRAIT FRAME","SQUARE MINI PORTRAIT FRAME","1.95",100000
"23452",1,"HEART MINI PORTRAIT FRAME","HEART MINI PORTRAIT FRAME","1.95",100000
"23453",1,"OVAL  MINI PORTRAIT FRAME","OVAL  MINI PORTRAIT FRAME","1.95",100000
"23454",1,"THREE MINI HANGING FRAMES","THREE MINI HANGING FRAMES","4.15",100000
"23455",1,"SMALL PARLOUR PICTURE FRAME","SMALL PARLOUR PICTURE FRAME","2.89",100000
"23456",1,"MEDIUM PARLOUR PICTURE FRAME ","MEDIUM PARLOUR PICTURE FRAME ","4.15",100000
"23457",1,"LARGE PARLOUR PICTURE FRAME","LARGE PARLOUR PICTURE FRAME","4.95",100000
"23458",1,"DOLLY CABINET 3 DRAWERS ","DOLLY CABINET 3 DRAWERS ","14.95",100000
"23459",1,"DOLLY CABINET 2 DRAWERS ","DOLLY CABINET 2 DRAWERS ","12.50",100000
"23460",1,"SWEETHEART WALL TIDY ","SWEETHEART WALL TIDY ","7.84",100000
"23461",1,"SWEETHEART BIRD HOUSE","SWEETHEART BIRD HOUSE","4.15",100000
"23462",1,"ROCOCO WALL MIRROR WHITE","ROCOCO WALL MIRROR WHITE","19.95",100000
"23463",1,"VINTAGE ZINC WATERING CAN","VINTAGE ZINC WATERING CAN","9.95",100000
"23464",1,"VINTAGE ZINC WATERING CAN SMALL","VINTAGE ZINC WATERING CAN SMALL","4.95",100000
"23465",1,"TUSCAN VILLA BIRD FEEDER","TUSCAN VILLA BIRD FEEDER","8.25",100000
"23466",1,"TUSCAN VILLA DOVECOTE BIRD FEEDER","TUSCAN VILLA DOVECOTE BIRD FEEDER","16.63",100000
"23467",1,"VINTAGE ZINC PLANTER  ","VINTAGE ZINC PLANTER  ","3.29",100000
"23468",1,"TUSCAN VILLA BIRD TABLE ","TUSCAN VILLA BIRD TABLE ","8.25",100000
"23469",1,"CARD HOLDER LOVE BIRD SMALL","CARD HOLDER LOVE BIRD SMALL","8.29",100000
"23470",1,"CARD HOLDER LOVE BIRD LARGE ","CARD HOLDER LOVE BIRD LARGE ","12.46",100000
"23471",1,"SIX DRAWER OFFICE TIDY","SIX DRAWER OFFICE TIDY","9.95",100000
"23472",1," NINE DRAWER OFFICE TIDY"," NINE DRAWER OFFICE TIDY","14.95",100000
"23473",1,"WOODLAND SMALL RED FELT HEART","WOODLAND SMALL RED FELT HEART","0.83",100000
"23474",1,"WOODLAND SMALL BLUE FELT HEART","WOODLAND SMALL BLUE FELT HEART","0.83",100000
"23475",1,"WOODLAND SMALL PINK FELT HEART","WOODLAND SMALL PINK FELT HEART","0.83",100000
"23476",1,"WOODLAND LARGE RED FELT HEART","WOODLAND LARGE RED FELT HEART","1.25",100000
"23477",1,"WOODLAND LARGE BLUE FELT HEART","WOODLAND LARGE BLUE FELT HEART","1.25",100000
"23478",1,"WOODLAND LARGE PINK FELT HEART","WOODLAND LARGE PINK FELT HEART","1.25",100000
"23479",1,"WIRE EGG BASKET ","WIRE EGG BASKET ","7.85",100000
"23480",1,"MINI LIGHTS WOODLAND MUSHROOMS","MINI LIGHTS WOODLAND MUSHROOMS","3.75",100000
"23481",1,"PEARLISED IVORY HEART SMALL ","PEARLISED IVORY HEART SMALL ","1.25",100000
"23482",1,"PEARLISED IVORY HEART LARGE ","PEARLISED IVORY HEART LARGE ","1.65",100000
"23483",1,"HANGING  BUTTERFLY T-LIGHT HOLDER","HANGING  BUTTERFLY T-LIGHT HOLDER","1.25",100000
"23484",1,"HEART TRELLIS TRIPLE T-LIGHT HOLDER","HEART TRELLIS TRIPLE T-LIGHT HOLDER","2.89",100000
"23485",1,"BOTANICAL GARDENS WALL CLOCK ","BOTANICAL GARDENS WALL CLOCK ","25.00",100000
"23486",1,"ANTIQUE HEART SHELF UNIT","ANTIQUE HEART SHELF UNIT","16.65",100000
"23487",1,"SWEET HEART CAKE CARRIER","SWEET HEART CAKE CARRIER","9.95",100000
"23489",1,"VINTAGE BELLS GARLAND","VINTAGE BELLS GARLAND","2.89",100000
"23490",1,"T-LIGHT HOLDER HANGING LOVE BIRD","T-LIGHT HOLDER HANGING LOVE BIRD","7.46",100000
"23491",1,"VINTAGE JINGLE BELLS HEART","VINTAGE JINGLE BELLS HEART","8.25",100000
"23492",1,"VINTAGE JINGLE BELLS WREATH","VINTAGE JINGLE BELLS WREATH","8.25",100000
"23493",1,"VINTAGE DOILY TRAVEL SEWING KIT","VINTAGE DOILY TRAVEL SEWING KIT","1.95",100000
"23494",1,"VINTAGE DOILY DELUXE SEWING KIT ","VINTAGE DOILY DELUXE SEWING KIT ","5.95",100000
"23495",1,"SET OF 3 PANTRY WOODEN SPOONS","SET OF 3 PANTRY WOODEN SPOONS","1.25",100000
"23496",1,"PANTRY KITCHEN THERMOMETER ","PANTRY KITCHEN THERMOMETER ","2.46",100000
"23497",1,"CLASSIC CHROME BICYCLE BELL ","CLASSIC CHROME BICYCLE BELL ","1.45",100000
"23498",1,"CLASSIC BICYCLE CLIPS ","CLASSIC BICYCLE CLIPS ","1.45",100000
"23499",1,"SET 12 VINTAGE DOILY CHALK ","SET 12 VINTAGE DOILY CHALK ","0.83",100000
"23500",1,"KEY RING BASEBALL BOOT ASSORTED ","KEY RING BASEBALL BOOT ASSORTED ","1.25",100000
"23501",1,"KEY RING BASEBALL BOOT UNION JACK","KEY RING BASEBALL BOOT UNION JACK","1.25",100000
"23502",1,"PLAYING CARDS VINTAGE DOILY ","PLAYING CARDS VINTAGE DOILY ","1.25",100000
"23503",1,"PLAYING CARDS KEEP CALM & CARRY ON","PLAYING CARDS KEEP CALM & CARRY ON","1.25",100000
"23504",1,"PLAYING CARDS JUBILEE UNION JACK","PLAYING CARDS JUBILEE UNION JACK","1.25",100000
"23505",1,"PLAYING CARDS I LOVE LONDON ","PLAYING CARDS I LOVE LONDON ","1.25",100000
"23506",1,"MINI PLAYING CARDS SPACEBOY ","MINI PLAYING CARDS SPACEBOY ","0.42",100000
"23507",1,"MINI PLAYING CARDS BUFFALO BILL ","MINI PLAYING CARDS BUFFALO BILL ","0.42",100000
"23508",1,"MINI PLAYING CARDS DOLLY GIRL ","MINI PLAYING CARDS DOLLY GIRL ","0.42",100000
"23509",1,"MINI PLAYING CARDS FUN FAIR ","MINI PLAYING CARDS FUN FAIR ","0.42",100000
"23510",1,"MINI PLAYING CARDS GYMKHANA","MINI PLAYING CARDS GYMKHANA","0.83",100000
"23511",1,"EMBROIDERED RIBBON REEL EMILY ","EMBROIDERED RIBBON REEL EMILY ","4.13",100000
"23512",1,"EMBROIDERED RIBBON REEL ROSIE","EMBROIDERED RIBBON REEL ROSIE","2.08",100000
"23513",1,"EMBROIDERED RIBBON REEL SUSIE ","EMBROIDERED RIBBON REEL SUSIE ","2.08",100000
"23514",1,"EMBROIDERED RIBBON REEL SALLY ","EMBROIDERED RIBBON REEL SALLY ","2.08",100000
"23515",1,"EMBROIDERED RIBBON REEL DAISY ","EMBROIDERED RIBBON REEL DAISY ","2.08",100000
"23516",1,"EMBROIDERED RIBBON REEL SOPHIE  ","EMBROIDERED RIBBON REEL SOPHIE  ","3.75",100000
"23517",1,"EMBROIDERED RIBBON REEL REBECCA ","EMBROIDERED RIBBON REEL REBECCA ","2.89",100000
"23518",1,"EMBROIDERED RIBBON REEL RACHEL ","EMBROIDERED RIBBON REEL RACHEL ","2.89",100000
"23519",1,"EMBROIDERED RIBBON REEL CLAIRE","EMBROIDERED RIBBON REEL CLAIRE","7.46",100000
"23520",1,"EMBROIDERED RIBBON REEL RUBY ","EMBROIDERED RIBBON REEL RUBY ","3.75",100000
"23521",1,"WALL ART CAT AND BIRD ","WALL ART CAT AND BIRD ","5.79",100000
"23522",1,"WALL ART DOG AND BALL ","WALL ART DOG AND BALL ","2.89",100000
"23523",1,"WALL ART TREASURE AHOY ","WALL ART TREASURE AHOY ","3.75",100000
"23524",1,"WALL ART HORSE & PONY ","WALL ART HORSE & PONY ","3.75",100000
"23525",1,"WALL ART BUFFALO BILL ","WALL ART BUFFALO BILL ","3.75",100000
"23526",1,"WALL ART DOG LICENCE ","WALL ART DOG LICENCE ","12.46",100000
"23527",1,"WALL ART ANIMALS AND NATURE ","WALL ART ANIMALS AND NATURE ","3.75",100000
"23528",1,"WALL ART SPACEBOY","WALL ART SPACEBOY","3.75",100000
"23529",1,"WALL ART DOLLY GIRL ","WALL ART DOLLY GIRL ","7.46",100000
"23530",1,"WALL ART ONLY ONE PERSON ","WALL ART ONLY ONE PERSON ","4.95",100000
"23531",1,"WALL ART BIG LOVE ","WALL ART BIG LOVE ","6.95",100000
"23532",1,"WALL ART WORK REST AND PLAY  ","WALL ART WORK REST AND PLAY  ","10.79",100000
"23533",1,"WALL ART GARDEN HAVEN ","WALL ART GARDEN HAVEN ","5.95",100000
"23534",1,"WALL ART STOP FOR TEA ","WALL ART STOP FOR TEA ","5.95",100000
"23535",1,"WALL ART BICYCLE SAFETY","WALL ART BICYCLE SAFETY","5.95",100000
"23536",1,"WALL ART VILLAGE SHOW ","WALL ART VILLAGE SHOW ","5.95",100000
"23537",1,"WALL ART I LOVE LONDON ","WALL ART I LOVE LONDON ","10.79",100000
"23538",1,"WALL ART VINTAGE HEART","WALL ART VINTAGE HEART","10.79",100000
"23539",1,"WALL ART LOVES' SECRET ","WALL ART LOVES' SECRET ","5.95",100000
"23540",1,"WALL ART THE MAGIC FOREST ","WALL ART THE MAGIC FOREST ","6.95",100000
"23541",1,"WALL ART CLASSIC PUDDINGS ","WALL ART CLASSIC PUDDINGS ","16.63",100000
"23542",1,"WALL ART 70'S ALPHABET ","WALL ART 70'S ALPHABET ","16.63",100000
"23543",1,"WALL ART KEEP CALM ","WALL ART KEEP CALM ","4.15",100000
"23544",1,"WALL ART MID CENTURY MODERN ","WALL ART MID CENTURY MODERN ","3.95",100000
"23545",1,"WRAP RED VINTAGE DOILY","WRAP RED VINTAGE DOILY","0.42",100000
"23546",1,"WRAP PAISLEY PARK ","WRAP PAISLEY PARK ","0.42",100000
"23547",1,"WRAP FLOWER SHOP  ","WRAP FLOWER SHOP  ","0.42",100000
"23548",1,"WRAP MAGIC FOREST ","WRAP MAGIC FOREST ","0.42",100000
"23549",1,"WRAP BIRD GARDEN ","WRAP BIRD GARDEN ","0.42",100000
"23550",1,"WRAP ALPHABET POSTER  ","WRAP ALPHABET POSTER  ","0.42",100000
"23551",1,"PACK OF 12 PAISLEY PARK TISSUES ","PACK OF 12 PAISLEY PARK TISSUES ","0.83",100000
"23552",1,"BICYCLE PUNCTURE REPAIR KIT ","BICYCLE PUNCTURE REPAIR KIT ","2.08",100000
"23553",1,"LANDMARK FRAME CAMDEN TOWN ","LANDMARK FRAME CAMDEN TOWN ","12.50",100000
"23554",1,"LANDMARK FRAME OXFORD STREET","LANDMARK FRAME OXFORD STREET","12.50",100000
"23555",1,"LANDMARK FRAME NOTTING HILL ","LANDMARK FRAME NOTTING HILL ","12.50",100000
"23556",1,"LANDMARK FRAME COVENT GARDEN ","LANDMARK FRAME COVENT GARDEN ","12.50",100000
"23557",1,"LANDMARK FRAME BAKER STREET ","LANDMARK FRAME BAKER STREET ","12.50",100000
"23558",1,"LANDMARK FRAME LONDON BRIDGE ","LANDMARK FRAME LONDON BRIDGE ","12.50",100000
"23559",1,"WOODLAND BUNNIES LOLLY MAKERS","WOODLAND BUNNIES LOLLY MAKERS","4.13",100000
"23560",1,"SET OF 6 RIBBONS COUNTRY STYLE","SET OF 6 RIBBONS COUNTRY STYLE","2.89",100000
"23561",1,"SET OF 6 RIBBONS PARTY","SET OF 6 RIBBONS PARTY","5.79",100000
"23562",1,"SET OF 6 RIBBONS PERFECTLY PRETTY  ","SET OF 6 RIBBONS PERFECTLY PRETTY  ","5.79",100000
"23564",1,"EGG CUP MILKMAID INGRID","EGG CUP MILKMAID INGRID","2.46",100000
"23565",1,"EGG CUP MILKMAID HELGA ","EGG CUP MILKMAID HELGA ","1.25",100000
"23566",1,"EGG CUP MILKMAID HEIDI","EGG CUP MILKMAID HEIDI","1.25",100000
"23567",1,"EGG CUP HENRIETTA HEN PINK","EGG CUP HENRIETTA HEN PINK","1.25",100000
"23568",1,"EGG CUP HENRIETTA HEN CREAM ","EGG CUP HENRIETTA HEN CREAM ","2.46",100000
"23569",1,"TRADTIONAL ALPHABET STAMP SET","TRADTIONAL ALPHABET STAMP SET","4.95",100000
"23570",1,"TRADITIONAL PICK UP STICKS GAME ","TRADITIONAL PICK UP STICKS GAME ","1.25",100000
"23571",1,"TRADITIONAL NAUGHTS & CROSSES","TRADITIONAL NAUGHTS & CROSSES","1.65",100000
"23574",1,"PACKING CHARGE","PACKING CHARGE","7.50",100000
"23575",1,"SNACK TRAY PAISLEY PARK","SNACK TRAY PAISLEY PARK","4.13",100000
"23576",1,"SNACK TRAY RED VINTAGE DOILY","SNACK TRAY RED VINTAGE DOILY","1.95",100000
"23578",1,"SNACK TRAY RED GINGHAM","SNACK TRAY RED GINGHAM","1.95",100000
"23579",1,"SNACK TRAY I LOVE LONDON","SNACK TRAY I LOVE LONDON","1.95",100000
"23580",1,"SNACK TRAY HAPPY FOREST  ","SNACK TRAY HAPPY FOREST  ","1.95",100000
"23581",1,"JUMBO BAG PAISLEY PARK","JUMBO BAG PAISLEY PARK","2.08",100000
"23582",1,"VINTAGE DOILY JUMBO BAG RED ","VINTAGE DOILY JUMBO BAG RED ","2.08",100000
"23583",1,"LUNCH BAG PAISLEY PARK  ","LUNCH BAG PAISLEY PARK  ","1.65",100000
"23595",1,"adjustment","adjustment","0.00",100000
"23597",1,"PAPER BUNTING PAISLEY PARK","PAPER BUNTING PAISLEY PARK","2.95",100000
"23598",1,"PAPER BUNTING VINTAGE PARTY","PAPER BUNTING VINTAGE PARTY","2.95",100000
"23601",1,"SET 10 CARDS SNOWY SNOWDROPS  17100","SET 10 CARDS SNOWY SNOWDROPS  17100","2.49",100000
"23602",1,"SET 10 CARDS 3 WISE MEN 17107","SET 10 CARDS 3 WISE MEN 17107","2.91",100000
"23603",1,"SET 10 CARD KRAFT REINDEER 17084","SET 10 CARD KRAFT REINDEER 17084","2.49",100000
"23604",1,"SET 10 MINI SANTA & SNOWMAN  17087","SET 10 MINI SANTA & SNOWMAN  17087","1.66",100000
"23605",1,"SET 10 CARDS 12 DAYS OF XMAS 17059","SET 10 CARDS 12 DAYS OF XMAS 17059","2.91",100000
"23607",1,"SET 10 CARDS HATS & STOCKINGS 17081","SET 10 CARDS HATS & STOCKINGS 17081","1.66",100000
"23608",1,"SET 10 CARDS RUDOLPHS NOSE 17097","SET 10 CARDS RUDOLPHS NOSE 17097","2.91",100000
"23609",1,"SET 10 CARDS SNOWY ROBIN 17099","SET 10 CARDS SNOWY ROBIN 17099","2.91",100000
"23610",1,"SET 10 CARDS CHRISTMAS ROBIN 17095","SET 10 CARDS CHRISTMAS ROBIN 17095","2.08",100000
"23611",1,"SET 10 CARDS RED RIDING HOOD 17214","SET 10 CARDS RED RIDING HOOD 17214","2.49",100000
"23612",1,"SET 10 MINICARDS CUTE SNOWMAN 17071","SET 10 MINICARDS CUTE SNOWMAN 17071","1.66",100000
"23613",1,"SET 10 XMAS CARDS & BADGES 17070","SET 10 XMAS CARDS & BADGES 17070","2.49",100000
"23614",1,"SET 10 CARDS 12 DAYS WRAP  17058","SET 10 CARDS 12 DAYS WRAP  17058","3.33",100000
"23615",1,"SET 10 CARDS PRINTED GRAPHIC 17219","SET 10 CARDS PRINTED GRAPHIC 17219","2.49",100000
"23616",1,"SET 10 CARDS JINGLE BELLS 17217","SET 10 CARDS JINGLE BELLS 17217","2.49",100000
"23617",1,"SET 10 CARDS SWIRLY XMAS TREE 17104","SET 10 CARDS SWIRLY XMAS TREE 17104","2.91",100000
"23619",1,"SET 10 CARDS POINSETTIA 17093","SET 10 CARDS POINSETTIA 17093","2.49",100000
"23620",1,"SET 10 CARDS PERFECT POST 17090","SET 10 CARDS PERFECT POST 17090","2.49",100000
"23621",1,"SET 10 CARDS DAVID'S MADONNA 17074","SET 10 CARDS DAVID'S MADONNA 17074","2.49",100000
"23623",1,"SET 10 CARD CHRISTMAS WELCOME 17112","SET 10 CARD CHRISTMAS WELCOME 17112","2.91",100000
"23624",1,"SET 10 CARD PERFECT NATIVITY 17089","SET 10 CARD PERFECT NATIVITY 17089","2.49",100000
"23625",1,"SET 6 CARDS SPARKLY REINDEER 17262","SET 6 CARDS SPARKLY REINDEER 17262","4.99",100000
"23626",1,"SET 10 CARDS DINKY TREE 17076","SET 10 CARDS DINKY TREE 17076","2.49",100000
"23627",1,"SET 10 CARDS XMAS GRAPHIC  17218","SET 10 CARDS XMAS GRAPHIC  17218","2.49",100000
"23628",1,"SET 10 CARDS TRIANGLE ICONS  17220","SET 10 CARDS TRIANGLE ICONS  17220","2.91",100000
"23629",1,"SET 10 CARDS DRESSING UP 17077","SET 10 CARDS DRESSING UP 17077","2.49",100000
"23630",1,"SET 10 CARDS HANGING BAUBLES 17080","SET 10 CARDS HANGING BAUBLES 17080","2.49",100000
"23632",1,"SET 10 CARDS CHEERFUL ROBIN 17065","SET 10 CARDS CHEERFUL ROBIN 17065","2.08",100000
"23633",1,"SET 10 CARDS WORLD CHILDREN 17067","SET 10 CARDS WORLD CHILDREN 17067","2.49",100000
"23634",1,"SET 10 CARDS XMAS CHOIR 17068","SET 10 CARDS XMAS CHOIR 17068","2.91",100000
"23635",1,"SET 10 CARDS CHRISTMAS HOLLY  17259","SET 10 CARDS CHRISTMAS HOLLY  17259","4.16",100000
"23636",1,"SET 10 CARDS WISHING TREE 17116","SET 10 CARDS WISHING TREE 17116","2.91",100000
"23637",1,"SET 10 CARDS OUT OF ORDER 17216","SET 10 CARDS OUT OF ORDER 17216","2.49",100000
"23638",1,"SET 10 CARDS ROBIN WATERPUMP  17096","SET 10 CARDS ROBIN WATERPUMP  17096","2.91",100000
"23639",1,"SET 10 CARDS MAGICAL TREE 17086","SET 10 CARDS MAGICAL TREE 17086","3.33",100000
"23640",1,"SET 10 CARDS SCOTTIE DOG 17211","SET 10 CARDS SCOTTIE DOG 17211","2.49",100000
"23643",1,"SET 10 CARDS CHRISTMAS BAUBLE 16954","SET 10 CARDS CHRISTMAS BAUBLE 16954","3.33",100000
"23644",1,"SET 10 CARDS CHRISTMAS TREE 16955","SET 10 CARDS CHRISTMAS TREE 16955","3.33",100000
"23645",1,"SET 10 CHRISTMAS CARDS HOHOHO 16956","SET 10 CHRISTMAS CARDS HOHOHO 16956","2.49",100000
"23646",1,"SET 10 CARDS JINGLE BELLS 16957","SET 10 CARDS JINGLE BELLS 16957","2.49",100000
