"ProductId","CategoryId","ProductName","ProductDescription","ProductPrice","ProductQuantity"
"21981",1,"PACK OF 12 WOODLAND TISSUES ","PACK OF 12 WOODLAND TISSUES ","0.83",100000
"21982",1,"PACK OF 12 SUKI TISSUES ","PACK OF 12 SUKI TISSUES ","0.83",100000
"21983",1,"PACK OF 12 BLUE PAISLEY TISSUES ","PACK OF 12 BLUE PAISLEY TISSUES ","0.39",100000
"21984",1,"PACK OF 12 PINK PAISLEY TISSUES ","PACK OF 12 PINK PAISLEY TISSUES ","0.83",100000
"21985",1,"PACK OF 12 HEARTS DESIGN TISSUES ","PACK OF 12 HEARTS DESIGN TISSUES ","0.83",100000
"21986",1,"PACK OF 12 PINK POLKADOT TISSUES","PACK OF 12 PINK POLKADOT TISSUES","0.83",100000
"21987",1,"PACK OF 6 SKULL PAPER CUPS","PACK OF 6 SKULL PAPER CUPS","0.65",100000
"21988",1,"PACK OF 6 SKULL PAPER PLATES","PACK OF 6 SKULL PAPER PLATES","0.85",100000
"21989",1,"PACK OF 20 SKULL PAPER NAPKINS","PACK OF 20 SKULL PAPER NAPKINS","0.85",100000
"21990",1,"MODERN FLORAL STATIONERY SET","MODERN FLORAL STATIONERY SET","2.46",100000
"21991",1,"BOHEMIAN COLLAGE STATIONERY SET","BOHEMIAN COLLAGE STATIONERY SET","1.25",100000
"21992",1,"check","check","0.00",100000
"21993",1,"FLORAL FOLK STATIONERY SET","FLORAL FOLK STATIONERY SET","1.25",100000
"22003",1,"VINTAGE BLUE VACUUM FLASK 0.5L ","VINTAGE BLUE VACUUM FLASK 0.5L ","0.00",100000
"22016",1,"Dotcomgiftshop Gift Voucher 100.00","Dotcomgiftshop Gift Voucher 100.00","83.33",100000
"22021",1,"BLUE FELT EASTER EGG BASKET","BLUE FELT EASTER EGG BASKET","1.65",100000
"22023",1,"EMPIRE BIRTHDAY CARD","EMPIRE BIRTHDAY CARD","0.83",100000
"22024",1,"RAINY LADIES BIRTHDAY CARD","RAINY LADIES BIRTHDAY CARD","0.83",100000
"22025",1,"RING OF ROSES BIRTHDAY CARD","RING OF ROSES BIRTHDAY CARD","0.83",100000
"22026",1,"BANQUET BIRTHDAY  CARD  ","BANQUET BIRTHDAY  CARD  ","0.42",100000
"22027",1,"TEA PARTY BIRTHDAY CARD","TEA PARTY BIRTHDAY CARD","0.42",100000
"22028",1,"PENNY FARTHING BIRTHDAY CARD","PENNY FARTHING BIRTHDAY CARD","0.42",100000
"22029",1,"SPACEBOY BIRTHDAY CARD","SPACEBOY BIRTHDAY CARD","0.83",100000
"22030",1,"SWALLOWS GREETING CARD","SWALLOWS GREETING CARD","0.83",100000
"22031",1,"BOTANICAL LAVENDER BIRTHDAY CARD","BOTANICAL LAVENDER BIRTHDAY CARD","0.83",100000
"22032",1,"BOTANICAL LILY GREETING CARD","BOTANICAL LILY GREETING CARD","0.42",100000
"22033",1,"BOTANICAL ROSE GREETING CARD","BOTANICAL ROSE GREETING CARD","0.83",100000
"22034",1,"ROBIN CHRISTMAS CARD","ROBIN CHRISTMAS CARD","0.83",100000
"22035",1,"VINTAGE CARAVAN GREETING CARD ","VINTAGE CARAVAN GREETING CARD ","0.83",100000
"22036",1,"DINOSAUR BIRTHDAY CARD","DINOSAUR BIRTHDAY CARD","0.85",100000
"22037",1,"ROBOT BIRTHDAY CARD","ROBOT BIRTHDAY CARD","0.42",100000
"22038",1,"BOTANICAL LAVENDER GIFT WRAP ","BOTANICAL LAVENDER GIFT WRAP ","0.42",100000
"22039",1,"BOTANICAL LILY GIFT WRAP","BOTANICAL LILY GIFT WRAP","0.42",100000
"22040",1,"BOTANICAL ROSE GIFT WRAP","BOTANICAL ROSE GIFT WRAP","0.42",100000
"22041",1,"RECORD FRAME 7"" SINGLE SIZE ","RECORD FRAME 7"" SINGLE SIZE ","4.96",100000
"22042",1,"CHRISTMAS CARD SINGING ANGEL","CHRISTMAS CARD SINGING ANGEL","0.42",100000
"22043",1,"CHRISTMAS CARD SCREEN PRINT ","CHRISTMAS CARD SCREEN PRINT ","0.42",100000
"22044",1,"CHRISTMAS CARD STACK OF PRESENTS","CHRISTMAS CARD STACK OF PRESENTS","0.19",100000
"22045",1,"SPACEBOY GIFT WRAP","SPACEBOY GIFT WRAP","0.42",100000
"22046",1,"TEA PARTY  WRAPPING PAPER ","TEA PARTY  WRAPPING PAPER ","0.42",100000
"22047",1,"EMPIRE GIFT WRAP","EMPIRE GIFT WRAP","0.42",100000
"22048",1,"BIRTHDAY BANQUET GIFT WRAP","BIRTHDAY BANQUET GIFT WRAP","0.42",100000
"22049",1,"WRAP CHRISTMAS SCREEN PRINT","WRAP CHRISTMAS SCREEN PRINT","0.19",100000
"22050",1,"PINK PAISLEY ROSE GIFT WRAP","PINK PAISLEY ROSE GIFT WRAP","0.42",100000
"22051",1,"BLUE SCANDINAVIAN PAISLEY WRAP","BLUE SCANDINAVIAN PAISLEY WRAP","0.42",100000
"22052",1,"VINTAGE CARAVAN GIFT WRAP","VINTAGE CARAVAN GIFT WRAP","0.42",100000
"22053",1,"EMPIRE DESIGN ROSETTE","EMPIRE DESIGN ROSETTE","1.25",100000
"22054",1,"MINI CAKE STAND HANGING HEARTS","MINI CAKE STAND HANGING HEARTS","1.65",100000
"22055",1,"MINI CAKE STAND  HANGING STRAWBERY","MINI CAKE STAND  HANGING STRAWBERY","0.39",100000
"22056",1,"CERAMIC PLATE LOVE HEART DESIGN","CERAMIC PLATE LOVE HEART DESIGN","0.87",100000
"22057",1,"CERAMIC PLATE STRAWBERRY DESIGN","CERAMIC PLATE STRAWBERRY DESIGN","0.39",100000
"22058",1,"CERAMIC LOVE HEARTS DESIGN MUG","CERAMIC LOVE HEARTS DESIGN MUG","1.49",100000
"22059",1,"CERAMIC STRAWBERRY DESIGN MUG","CERAMIC STRAWBERRY DESIGN MUG","0.39",100000
"22060",1,"LARGE CAKE STAND HANGING HEARTS","LARGE CAKE STAND HANGING HEARTS","3.95",100000
"22061",1,"LARGE CAKE STAND  HANGING STRAWBERY","LARGE CAKE STAND  HANGING STRAWBERY","2.95",100000
"22062",1,"CERAMIC BOWL WITH LOVE HEART DESIGN","CERAMIC BOWL WITH LOVE HEART DESIGN","0.00",100000
"22063",1,"CERAMIC BOWL WITH STRAWBERRY DESIGN","CERAMIC BOWL WITH STRAWBERRY DESIGN","0.79",100000
"22064",1,"PINK DOUGHNUT TRINKET POT ","PINK DOUGHNUT TRINKET POT ","0.39",100000
"22065",1,"CHRISTMAS PUDDING TRINKET POT ","CHRISTMAS PUDDING TRINKET POT ","0.39",100000
"22066",1,"LOVE HEART TRINKET POT","LOVE HEART TRINKET POT","0.39",100000
"22067",1,"CHOC TRUFFLE GOLD TRINKET POT ","CHOC TRUFFLE GOLD TRINKET POT ","0.39",100000
"22068",1,"BLACK PIRATE TREASURE CHEST","BLACK PIRATE TREASURE CHEST","3.29",100000
"22069",1,"BROWN  PIRATE TREASURE CHEST ","BROWN  PIRATE TREASURE CHEST ","3.29",100000
"22070",1,"SMALL RED RETROSPOT MUG IN BOX ","SMALL RED RETROSPOT MUG IN BOX ","7.46",100000
"22071",1,"SMALL WHITE RETROSPOT MUG IN BOX ","SMALL WHITE RETROSPOT MUG IN BOX ","3.75",100000
"22072",1,"RED RETROSPOT TEA CUP AND SAUCER ","RED RETROSPOT TEA CUP AND SAUCER ","1.25",100000
"22073",1,"RED RETROSPOT STORAGE JAR","RED RETROSPOT STORAGE JAR","3.75",100000
"22074",1,"6 RIBBONS SHIMMERING PINKS ","6 RIBBONS SHIMMERING PINKS ","1.25",100000
"22075",1,"6 RIBBONS ELEGANT CHRISTMAS ","6 RIBBONS ELEGANT CHRISTMAS ","0.39",100000
"22076",1,"6 RIBBONS EMPIRE  ","6 RIBBONS EMPIRE  ","0.39",100000
"22077",1,"6 RIBBONS RUSTIC CHARM","6 RIBBONS RUSTIC CHARM","1.95",100000
"22078",1,"RIBBON REEL LACE DESIGN ","RIBBON REEL LACE DESIGN ","2.10",100000
"22079",1,"RIBBON REEL HEARTS DESIGN ","RIBBON REEL HEARTS DESIGN ","1.65",100000
"22080",1,"RIBBON REEL POLKADOTS ","RIBBON REEL POLKADOTS ","1.65",100000
"22081",1,"RIBBON REEL FLORA + FAUNA ","RIBBON REEL FLORA + FAUNA ","3.29",100000
"22082",1,"RIBBON REEL STRIPES DESIGN ","RIBBON REEL STRIPES DESIGN ","3.29",100000
"22083",1,"PAPER CHAIN KIT RETROSPOT","PAPER CHAIN KIT RETROSPOT","5.79",100000
"22084",1,"PAPER CHAIN KIT EMPIRE","PAPER CHAIN KIT EMPIRE","0.00",100000
"22085",1,"PAPER CHAIN KIT SKULLS ","PAPER CHAIN KIT SKULLS ","2.95",100000
"22086",1,"PAPER CHAIN KIT 50'S CHRISTMAS ","PAPER CHAIN KIT 50'S CHRISTMAS ","2.95",100000
"22087",1,"PAPER BUNTING WHITE LACE","PAPER BUNTING WHITE LACE","5.79",100000
"22088",1,"PAPER BUNTING COLOURED LACE","PAPER BUNTING COLOURED LACE","0.00",100000
"22089",1,"PAPER BUNTING VINTAGE PAISLEY","PAPER BUNTING VINTAGE PAISLEY","2.95",100000
"22090",1,"PAPER BUNTING RETROSPOT","PAPER BUNTING RETROSPOT","2.95",100000
"22091",1,"EMPIRE TISSUE BOX","EMPIRE TISSUE BOX","0.39",100000
"22092",1,"BLUE PAISLEY TISSUE BOX","BLUE PAISLEY TISSUE BOX","0.39",100000
"22093",1,"MOTORING TISSUE BOX","MOTORING TISSUE BOX","0.39",100000
"22094",1,"RED RETROSPOT TISSUE BOX","RED RETROSPOT TISSUE BOX","0.39",100000
"22095",1,"LADS ONLY TISSUE BOX","LADS ONLY TISSUE BOX","2.46",100000
"22096",1,"PINK PAISLEY SQUARE TISSUE BOX ","PINK PAISLEY SQUARE TISSUE BOX ","0.39",100000
"22097",1,"SWALLOW SQUARE TISSUE BOX","SWALLOW SQUARE TISSUE BOX","0.39",100000
"22098",1,"BOUDOIR SQUARE TISSUE BOX","BOUDOIR SQUARE TISSUE BOX","0.39",100000
"22099",1,"CARAVAN SQUARE TISSUE BOX","CARAVAN SQUARE TISSUE BOX","0.39",100000
"22100",1,"SKULLS SQUARE TISSUE BOX","SKULLS SQUARE TISSUE BOX","2.46",100000
"22101",1,"MIRROR MOSAIC VOTIVE HOLDER","MIRROR MOSAIC VOTIVE HOLDER","2.10",100000
"22102",1,"MIRROR MOSAIC T-LIGHT HOLDER ","MIRROR MOSAIC T-LIGHT HOLDER ","1.65",100000
"22103",1,"MIRROR MOSAIC T-LIGHT HOLDER ROUND","MIRROR MOSAIC T-LIGHT HOLDER ROUND","0.39",100000
"22104",1,"MIRROR MOSAIC CANDLE PLATE","MIRROR MOSAIC CANDLE PLATE","1.45",100000
"22105",1,"MIRROR MOSAIC GOBLET CANDLE HOLDER","MIRROR MOSAIC GOBLET CANDLE HOLDER","4.13",100000
"22106",1,"MIRROR MOSAIC HURRICANE LAMP ","MIRROR MOSAIC HURRICANE LAMP ","4.96",100000
"22107",1,"PIZZA PLATE IN BOX","PIZZA PLATE IN BOX","1.25",100000
"22108",1,"PING! MICROWAVE PLATE","PING! MICROWAVE PLATE","3.29",100000
"22109",1,"FULL ENGLISH BREAKFAST PLATE","FULL ENGLISH BREAKFAST PLATE","7.46",100000
"22110",1,"BIRD HOUSE HOT WATER BOTTLE","BIRD HOUSE HOT WATER BOTTLE","5.79",100000
"22111",1,"SCOTTIE DOG HOT WATER BOTTLE","SCOTTIE DOG HOT WATER BOTTLE","4.95",100000
"22112",1,"CHOCOLATE HOT WATER BOTTLE","CHOCOLATE HOT WATER BOTTLE","4.95",100000
"22113",1,"GREY HEART HOT WATER BOTTLE","GREY HEART HOT WATER BOTTLE","4.25",100000
"22114",1,"HOT WATER BOTTLE TEA AND SYMPATHY","HOT WATER BOTTLE TEA AND SYMPATHY","4.25",100000
"22115",1,"METAL SIGN EMPIRE TEA","METAL SIGN EMPIRE TEA","0.79",100000
"22116",1,"METAL SIGN HIS DINNER IS SERVED","METAL SIGN HIS DINNER IS SERVED","0.79",100000
"22117",1,"METAL SIGN HER DINNER IS SERVED ","METAL SIGN HER DINNER IS SERVED ","2.95",100000
"22118",1,"JOY WOODEN BLOCK LETTERS","JOY WOODEN BLOCK LETTERS","1.25",100000
"22119",1,"PEACE WOODEN BLOCK LETTERS","PEACE WOODEN BLOCK LETTERS","1.95",100000
"22120",1,"WELCOME  WOODEN BLOCK LETTERS","WELCOME  WOODEN BLOCK LETTERS","9.95",100000
"22121",1,"NOEL WOODEN BLOCK LETTERS ","NOEL WOODEN BLOCK LETTERS ","5.95",100000
"22122",1,"SET OF 2 FANCY FONT TEA TOWELS","SET OF 2 FANCY FONT TEA TOWELS","2.95",100000
"22123",1,"PING MICROWAVE APRON","PING MICROWAVE APRON","0.79",100000
"22124",1,"SET OF 2 TEA TOWELS PING MICROWAVE","SET OF 2 TEA TOWELS PING MICROWAVE","2.46",100000
"22125",1,"UNION JACK HOT WATER BOTTLE ","UNION JACK HOT WATER BOTTLE ","0.00",100000
"22127",1,"PARTY CONES CARNIVAL ASSORTED","PARTY CONES CARNIVAL ASSORTED","1.25",100000
"22128",1,"PARTY CONES CANDY ASSORTED","PARTY CONES CANDY ASSORTED","1.25",100000
"22129",1,"PARTY CONES CANDY DECORATION","PARTY CONES CANDY DECORATION","2.46",100000
"22130",1,"PARTY CONE CHRISTMAS DECORATION ","PARTY CONE CHRISTMAS DECORATION ","0.85",100000
"22131",1,"FOOD CONTAINER SET 3 LOVE HEART ","FOOD CONTAINER SET 3 LOVE HEART ","1.95",100000
"22132",1,"RED LOVE HEART SHAPE CUP","RED LOVE HEART SHAPE CUP","1.63",100000
"22133",1,"PINK LOVE HEART SHAPE CUP","PINK LOVE HEART SHAPE CUP","1.63",100000
"22134",1,"MINI LADLE LOVE HEART RED ","MINI LADLE LOVE HEART RED ","0.83",100000
"22135",1,"MINI LADLE LOVE HEART PINK","MINI LADLE LOVE HEART PINK","0.83",100000
"22136",1,"LOVE HEART SOCK HANGER","LOVE HEART SOCK HANGER","1.65",100000
"22137",1,"BATHROOM SET LOVE HEART DESIGN","BATHROOM SET LOVE HEART DESIGN","2.95",100000
"22138",1,"BAKING SET 9 PIECE RETROSPOT ","BAKING SET 9 PIECE RETROSPOT ","4.95",100000
"22139",1,"RETROSPOT TEA SET CERAMIC 11 PC ","RETROSPOT TEA SET CERAMIC 11 PC ","4.95",100000
"22141",1,"CHRISTMAS CRAFT TREE TOP ANGEL","CHRISTMAS CRAFT TREE TOP ANGEL","4.13",100000
"22142",1,"CHRISTMAS CRAFT WHITE FAIRY ","CHRISTMAS CRAFT WHITE FAIRY ","1.45",100000
"22143",1,"CHRISTMAS CRAFT HEART DECORATIONS","CHRISTMAS CRAFT HEART DECORATIONS","2.10",100000
"22144",1,"CHRISTMAS CRAFT LITTLE FRIENDS","CHRISTMAS CRAFT LITTLE FRIENDS","2.10",100000
"22145",1,"CHRISTMAS CRAFT HEART STOCKING ","CHRISTMAS CRAFT HEART STOCKING ","0.00",100000
"22146",1,"EASTER CRAFT IVY WREATH WITH CHICK","EASTER CRAFT IVY WREATH WITH CHICK","1.95",100000
"22147",1,"FELTCRAFT BUTTERFLY HEARTS","FELTCRAFT BUTTERFLY HEARTS","1.45",100000
"22148",1,"EASTER CRAFT 4 CHICKS ","EASTER CRAFT 4 CHICKS ","1.95",100000
"22149",1,"check","check","0.00",100000
"22150",1,"3 STRIPEY MICE FELTCRAFT","3 STRIPEY MICE FELTCRAFT","1.95",100000
"22151",1,"PLACE SETTING WHITE HEART","PLACE SETTING WHITE HEART","0.42",100000
"22152",1,"PLACE SETTING WHITE STAR","PLACE SETTING WHITE STAR","0.42",100000
"22153",1,"ANGEL DECORATION STARS ON DRESS","ANGEL DECORATION STARS ON DRESS","0.42",100000
"22154",1,"ANGEL DECORATION 3 BUTTONS ","ANGEL DECORATION 3 BUTTONS ","0.42",100000
"22155",1,"STAR DECORATION RUSTIC","STAR DECORATION RUSTIC","0.42",100000
"22156",1,"HEART DECORATION WITH PEARLS ","HEART DECORATION WITH PEARLS ","0.85",100000
"22157",1,"ANGEL DECORATION WITH LACE PADDED","ANGEL DECORATION WITH LACE PADDED","0.85",100000
"22158",1,"3 HEARTS HANGING DECORATION RUSTIC","3 HEARTS HANGING DECORATION RUSTIC","2.95",100000
"22161",1,"HEART DECORATION RUSTIC HANGING ","HEART DECORATION RUSTIC HANGING ","0.19",100000
"22162",1,"HEART GARLAND RUSTIC PADDED","HEART GARLAND RUSTIC PADDED","3.29",100000
"22163",1,"HEART STRING MEMO HOLDER HANGING","HEART STRING MEMO HOLDER HANGING","1.63",100000
"22164",1,"STRING OF STARS CARD HOLDER","STRING OF STARS CARD HOLDER","2.95",100000
"22165",1,"DIAMANTE HEART SHAPED WALL MIRROR, ","DIAMANTE HEART SHAPED WALL MIRROR, ","12.75",100000
"22166",1,"WALL MIRROR RECTANGLE DIAMANTE PINK","WALL MIRROR RECTANGLE DIAMANTE PINK","15.79",100000
"22167",1," OVAL WALL MIRROR DIAMANTE "," OVAL WALL MIRROR DIAMANTE ","9.95",100000
"22168",1,"ORGANISER WOOD ANTIQUE WHITE ","ORGANISER WOOD ANTIQUE WHITE ","8.50",100000
"22169",1,"FAMILY ALBUM WHITE PICTURE FRAME","FAMILY ALBUM WHITE PICTURE FRAME","8.50",100000
"22170",1,"PICTURE FRAME WOOD TRIPLE PORTRAIT","PICTURE FRAME WOOD TRIPLE PORTRAIT","6.75",100000
"22171",1,"3 HOOK PHOTO SHELF ANTIQUE WHITE","3 HOOK PHOTO SHELF ANTIQUE WHITE","8.50",100000
"22172",1,"METAL SHELF WITH RAIL ","METAL SHELF WITH RAIL ","8.50",100000
"22173",1,"METAL 4 HOOK HANGER FRENCH CHATEAU","METAL 4 HOOK HANGER FRENCH CHATEAU","3.29",100000
"22174",1,"PHOTO CUBE","PHOTO CUBE","3.29",100000
"22175",1,"PINK OWL SOFT TOY","PINK OWL SOFT TOY","2.95",100000
"22176",1,"amazon","amazon","0.00",100000
"22177",1,"5 HOOK BLACKBOARD ORGANISER ","5 HOOK BLACKBOARD ORGANISER ","8.50",100000
"22178",1,"VICTORIAN GLASS HANGING T-LIGHT","VICTORIAN GLASS HANGING T-LIGHT","1.95",100000
"22179",1,"SET 10 NIGHT OWL LIGHTS","SET 10 NIGHT OWL LIGHTS","13.29",100000
"22180",1,"RETROSPOT LAMP","RETROSPOT LAMP","19.96",100000
"22181",1,"SNOWSTORM PHOTO FRAME FRIDGE MAGNET","SNOWSTORM PHOTO FRAME FRIDGE MAGNET","0.85",100000
"22182",1,"CAKE STAND VICTORIAN FILIGREE SMALL","CAKE STAND VICTORIAN FILIGREE SMALL","4.95",100000
"22183",1,"CAKE STAND VICTORIAN FILIGREE MED","CAKE STAND VICTORIAN FILIGREE MED","6.75",100000
"22184",1,"CAKE STAND VICTORIAN FILIGREE LARGE","CAKE STAND VICTORIAN FILIGREE LARGE","8.50",100000
"22185",1,"SLATE TILE NATURAL HANGING","SLATE TILE NATURAL HANGING","1.65",100000
"22186",1,"RED STAR CARD HOLDER","RED STAR CARD HOLDER","1.95",100000
"22187",1,"GREEN CHRISTMAS TREE CARD HOLDER","GREEN CHRISTMAS TREE CARD HOLDER","8.29",100000
"22188",1,"BLACK HEART CARD HOLDER","BLACK HEART CARD HOLDER","3.95",100000
"22189",1,"CREAM HEART CARD HOLDER","CREAM HEART CARD HOLDER","3.95",100000
"22190",1,"LOCAL CAFE MUG","LOCAL CAFE MUG","2.46",100000
"22191",1,"IVORY DINER WALL CLOCK","IVORY DINER WALL CLOCK","8.50",100000
"22192",1,"BLUE DINER WALL CLOCK","BLUE DINER WALL CLOCK","8.50",100000
"22193",1,"RED DINER WALL CLOCK","RED DINER WALL CLOCK","8.50",100000
"22194",1,"BLACK DINER WALL CLOCK","BLACK DINER WALL CLOCK","0.00",100000
"22195",1,"LARGE HEART MEASURING SPOONS","LARGE HEART MEASURING SPOONS","1.65",100000
"22196",1,"SMALL HEART MEASURING SPOONS","SMALL HEART MEASURING SPOONS","1.63",100000
"22197",1,"POPCORN HOLDER","POPCORN HOLDER","0.85",100000
"22198",1,"LARGE POPCORN HOLDER ","LARGE POPCORN HOLDER ","1.65",100000
"22199",1,"FRYING PAN RED RETROSPOT","FRYING PAN RED RETROSPOT","8.29",100000
"22200",1,"FRYING PAN PINK POLKADOT","FRYING PAN PINK POLKADOT","1.25",100000
"22201",1,"FRYING PAN BLUE POLKADOT","FRYING PAN BLUE POLKADOT","1.25",100000
"22202",1,"MILK PAN PINK RETROSPOT","MILK PAN PINK RETROSPOT","0.00",100000
"22203",1,"MILK PAN RED RETROSPOT","MILK PAN RED RETROSPOT","1.25",100000
"22204",1,"MILK PAN BLUE POLKADOT","MILK PAN BLUE POLKADOT","3.75",100000
"22206",1,"MUG , DOTCOMGIFTSHOP.COM ","MUG , DOTCOMGIFTSHOP.COM ","0.83",100000
"22207",1,"FRYING PAN UNION FLAG","FRYING PAN UNION FLAG","8.29",100000
"22208",1,"WOOD STAMP SET THANK YOU","WOOD STAMP SET THANK YOU","0.83",100000
"22209",1,"WOOD STAMP SET HAPPY BIRTHDAY","WOOD STAMP SET HAPPY BIRTHDAY","0.83",100000
"22210",1,"WOOD STAMP SET BEST WISHES","WOOD STAMP SET BEST WISHES","0.83",100000
"22211",1,"WOOD STAMP SET FLOWERS","WOOD STAMP SET FLOWERS","3.29",100000
"22212",1,"FOUR HOOK  WHITE LOVEBIRDS","FOUR HOOK  WHITE LOVEBIRDS","2.10",100000
"22214",1,"CANDLE PLATE LACE WHITE","CANDLE PLATE LACE WHITE","4.96",100000
"22215",1,"CAKE STAND WHITE TWO TIER LACE","CAKE STAND WHITE TWO TIER LACE","2.95",100000
"22216",1,"T-LIGHT HOLDER WHITE LACE","T-LIGHT HOLDER WHITE LACE","1.63",100000
"22217",1,"T-LIGHT HOLDER HANGING LACE","T-LIGHT HOLDER HANGING LACE","0.39",100000
"22218",1,"CAKE STAND LACE WHITE","CAKE STAND LACE WHITE","4.25",100000
"22219",1,"LOVEBIRD HANGING DECORATION WHITE ","LOVEBIRD HANGING DECORATION WHITE ","1.63",100000
"22220",1,"CAKE STAND LOVEBIRD 2 TIER WHITE","CAKE STAND LOVEBIRD 2 TIER WHITE","2.95",100000
"22221",1,"CAKE STAND LOVEBIRD 2 TIER PINK","CAKE STAND LOVEBIRD 2 TIER PINK","2.95",100000
"22222",1,"CAKE PLATE LOVEBIRD WHITE","CAKE PLATE LOVEBIRD WHITE","4.95",100000
"22223",1,"CAKE PLATE LOVEBIRD PINK","CAKE PLATE LOVEBIRD PINK","9.96",100000
"22224",1,"WHITE LOVEBIRD LANTERN","WHITE LOVEBIRD LANTERN","5.79",100000
"22227",1,"HANGING HEART MIRROR DECORATION ","HANGING HEART MIRROR DECORATION ","0.65",100000
"22228",1,"BUNNY WOODEN PAINTED WITH BIRD ","BUNNY WOODEN PAINTED WITH BIRD ","0.39",100000
"22229",1,"BUNNY WOODEN PAINTED WITH FLOWER ","BUNNY WOODEN PAINTED WITH FLOWER ","0.39",100000
"22230",1,"JIGSAW TREE WITH WATERING CAN","JIGSAW TREE WITH WATERING CAN","1.63",100000
"22231",1,"JIGSAW TREE WITH BIRDHOUSE","JIGSAW TREE WITH BIRDHOUSE","0.59",100000
"22232",1,"JIGSAW TOADSTOOLS 3 PIECE","JIGSAW TOADSTOOLS 3 PIECE","0.59",100000
"22233",1,"JIGSAW RABBIT AND BIRDHOUSE","JIGSAW RABBIT AND BIRDHOUSE","0.59",100000
"22236",1,"CAKE STAND 3 TIER MAGIC GARDEN","CAKE STAND 3 TIER MAGIC GARDEN","12.75",100000
"22241",1,"GARLAND WOODEN HAPPY EASTER","GARLAND WOODEN HAPPY EASTER","1.25",100000
"22242",1,"5 HOOK HANGER MAGIC TOADSTOOL","5 HOOK HANGER MAGIC TOADSTOOL","1.65",100000
"22243",1,"5 HOOK HANGER RED MAGIC TOADSTOOL","5 HOOK HANGER RED MAGIC TOADSTOOL","1.65",100000
"22244",1,"3 HOOK HANGER MAGIC GARDEN","3 HOOK HANGER MAGIC GARDEN","1.95",100000
"22245",1,"HOOK, 1 HANGER ,MAGIC GARDEN","HOOK, 1 HANGER ,MAGIC GARDEN","0.85",100000
"22246",1,"MAGIC GARDEN FELT GARLAND ","MAGIC GARDEN FELT GARLAND ","1.95",100000
"22247",1,"BUNNY DECORATION MAGIC GARDEN","BUNNY DECORATION MAGIC GARDEN","0.85",100000
"22248",1,"DECORATION  PINK CHICK MAGIC GARDEN","DECORATION  PINK CHICK MAGIC GARDEN","0.85",100000
"22249",1,"DECORATION WHITE CHICK MAGIC GARDEN","DECORATION WHITE CHICK MAGIC GARDEN","0.85",100000
"22250",1,"DECORATION  BUTTERFLY  MAGIC GARDEN","DECORATION  BUTTERFLY  MAGIC GARDEN","1.63",100000
"22251",1,"BIRDHOUSE DECORATION MAGIC GARDEN","BIRDHOUSE DECORATION MAGIC GARDEN","2.46",100000
"22252",1,"BIRDCAGE DECORATION TEALIGHT HOLDER","BIRDCAGE DECORATION TEALIGHT HOLDER","1.25",100000
"22253",1,"6 CROCHET STRAWBERRIES","6 CROCHET STRAWBERRIES","1.06",100000
"22254",1,"FELT TOADSTOOL LARGE","FELT TOADSTOOL LARGE","1.25",100000
"22255",1,"FELT TOADSTOOL  SMALL","FELT TOADSTOOL  SMALL","0.85",100000
"22256",1,"FELT FARM ANIMAL CHICKEN","FELT FARM ANIMAL CHICKEN","2.46",100000
"22257",1,"FELT FARM ANIMAL SHEEP","FELT FARM ANIMAL SHEEP","1.25",100000
"22258",1,"FELT FARM ANIMAL RABBIT","FELT FARM ANIMAL RABBIT","1.25",100000
"22259",1,"FELT FARM ANIMAL HEN","FELT FARM ANIMAL HEN","1.25",100000
"22260",1,"FELT EGG COSY BLUE RABBIT ","FELT EGG COSY BLUE RABBIT ","1.63",100000
"22261",1,"FELT EGG COSY WHITE RABBIT ","FELT EGG COSY WHITE RABBIT ","1.63",100000
"22262",1,"FELT EGG COSY CHICKEN","FELT EGG COSY CHICKEN","1.63",100000
"22263",1,"FELT EGG COSY LADYBIRD ","FELT EGG COSY LADYBIRD ","1.63",100000
"22264",1,"FELT FARM ANIMAL WHITE BUNNY ","FELT FARM ANIMAL WHITE BUNNY ","1.63",100000
"22265",1,"EASTER DECORATION NATURAL CHICK","EASTER DECORATION NATURAL CHICK","0.65",100000
"22266",1,"EASTER DECORATION HANGING BUNNY","EASTER DECORATION HANGING BUNNY","0.19",100000
"22267",1,"EASTER DECORATION EGG BUNNY ","EASTER DECORATION EGG BUNNY ","0.39",100000
"22268",1,"DECORATION SITTING BUNNY","DECORATION SITTING BUNNY","0.19",100000
"22269",1,"EGG CUP NATURAL CHICKEN","EGG CUP NATURAL CHICKEN","2.46",100000
"22270",1,"HAPPY EASTER HANGING DECORATION","HAPPY EASTER HANGING DECORATION","3.75",100000
"22271",1,"FELTCRAFT DOLL ROSIE","FELTCRAFT DOLL ROSIE","2.95",100000
"22272",1,"FELTCRAFT DOLL MARIA","FELTCRAFT DOLL MARIA","2.95",100000
"22273",1,"FELTCRAFT DOLL MOLLY","FELTCRAFT DOLL MOLLY","2.95",100000
"22274",1,"FELTCRAFT DOLL EMILY","FELTCRAFT DOLL EMILY","2.95",100000
"22275",1,"WEEKEND BAG VINTAGE ROSE PAISLEY","WEEKEND BAG VINTAGE ROSE PAISLEY","7.65",100000
"22276",1,"WASH BAG VINTAGE ROSE PAISLEY","WASH BAG VINTAGE ROSE PAISLEY","2.55",100000
"22277",1,"COSMETIC BAG VINTAGE ROSE PAISLEY","COSMETIC BAG VINTAGE ROSE PAISLEY","4.13",100000
"22278",1,"OVERNIGHT BAG VINTAGE ROSE PAISLEY","OVERNIGHT BAG VINTAGE ROSE PAISLEY","10.79",100000
"22279",1,"POCKET BAG BLUE PAISLEY RED SPOT","POCKET BAG BLUE PAISLEY RED SPOT","2.46",100000
"22280",1,"POCKET BAG PINK PAISELY BROWN SPOT","POCKET BAG PINK PAISELY BROWN SPOT","1.25",100000
"22281",1,"EASTER TREE YELLOW BIRDS","EASTER TREE YELLOW BIRDS","5.95",100000
"22282",1,"12 EGG HOUSE PAINTED WOOD","12 EGG HOUSE PAINTED WOOD","12.75",100000
"22283",1,"6 EGG HOUSE PAINTED WOOD","6 EGG HOUSE PAINTED WOOD","7.95",100000
"22284",1,"HEN HOUSE DECORATION","HEN HOUSE DECORATION","3.29",100000
"22285",1,"HANGING HEN ON NEST DECORATION","HANGING HEN ON NEST DECORATION","1.65",100000
"22286",1,"DECORATION WOBBLY RABBIT METAL ","DECORATION WOBBLY RABBIT METAL ","0.39",100000
"22287",1,"DECORATION WOBBLY CHICKEN","DECORATION WOBBLY CHICKEN","0.39",100000
"22288",1,"HANGING METAL RABBIT DECORATION","HANGING METAL RABBIT DECORATION","1.25",100000
"22289",1,"HANGING METAL CHICKEN DECORATION","HANGING METAL CHICKEN DECORATION","1.25",100000
"22290",1,"STANDING METAL RABBIT WITH EGG","STANDING METAL RABBIT WITH EGG","0.00",100000
"22291",1,"HANGING CHICK CREAM DECORATION","HANGING CHICK CREAM DECORATION","1.45",100000
"22292",1,"HANGING CHICK  YELLOW DECORATION","HANGING CHICK  YELLOW DECORATION","1.45",100000
"22293",1,"HANGING CHICK GREEN DECORATION","HANGING CHICK GREEN DECORATION","1.45",100000
"22294",1,"HEART FILIGREE DOVE  SMALL","HEART FILIGREE DOVE  SMALL","1.25",100000
"22295",1,"HEART FILIGREE DOVE LARGE","HEART FILIGREE DOVE LARGE","1.65",100000
"22296",1,"HEART IVORY TRELLIS LARGE","HEART IVORY TRELLIS LARGE","1.65",100000
"22297",1,"HEART IVORY TRELLIS SMALL","HEART IVORY TRELLIS SMALL","1.25",100000
"22299",1,"PIG KEYRING WITH LIGHT & SOUND ","PIG KEYRING WITH LIGHT & SOUND ","0.39",100000
"22300",1,"COFFEE MUG DOG + BALL DESIGN","COFFEE MUG DOG + BALL DESIGN","2.55",100000
"22301",1,"COFFEE MUG CAT + BIRD DESIGN","COFFEE MUG CAT + BIRD DESIGN","2.55",100000
"22302",1,"COFFEE MUG PEARS  DESIGN","COFFEE MUG PEARS  DESIGN","2.55",100000
"22303",1,"COFFEE MUG APPLES DESIGN","COFFEE MUG APPLES DESIGN","2.55",100000
"22304",1,"COFFEE MUG BLUE PAISLEY DESIGN","COFFEE MUG BLUE PAISLEY DESIGN","4.96",100000
"22305",1,"COFFEE MUG PINK PAISLEY DESIGN","COFFEE MUG PINK PAISLEY DESIGN","4.96",100000
"22306",1,"SILVER MUG BONE CHINA TREE OF LIFE","SILVER MUG BONE CHINA TREE OF LIFE","1.06",100000
"22307",1,"GOLD MUG BONE CHINA TREE OF LIFE","GOLD MUG BONE CHINA TREE OF LIFE","1.06",100000
"22308",1,"TEA COSY BLUE STRIPE","TEA COSY BLUE STRIPE","4.96",100000
"22309",1,"TEA COSY RED  STRIPE","TEA COSY RED  STRIPE","4.96",100000
"22310",1,"IVORY KNITTED MUG COSY ","IVORY KNITTED MUG COSY ","3.29",100000
"22311",1,"OFFICE MUG WARMER BLACK+SILVER ","OFFICE MUG WARMER BLACK+SILVER ","2.95",100000
"22312",1,"OFFICE MUG WARMER POLKADOT","OFFICE MUG WARMER POLKADOT","2.95",100000
"22313",1,"OFFICE MUG WARMER PINK","OFFICE MUG WARMER PINK","8.29",100000
"22314",1,"OFFICE MUG WARMER CHOC+BLUE","OFFICE MUG WARMER CHOC+BLUE","1.25",100000
"22315",1,"200 RED + WHITE BENDY STRAWS","200 RED + WHITE BENDY STRAWS","2.46",100000
"22316",1,"200 BENDY SKULL STRAWS","200 BENDY SKULL STRAWS","1.25",100000
"22317",1,"FIVE CATS HANGING DECORATION","FIVE CATS HANGING DECORATION","5.79",100000
"22318",1,"FIVE HEART HANGING DECORATION","FIVE HEART HANGING DECORATION","2.95",100000
"22319",1,"HAIRCLIPS FORTIES FABRIC ASSORTED","HAIRCLIPS FORTIES FABRIC ASSORTED","0.65",100000
"22320",1,"BIRDS MOBILE VINTAGE DESIGN","BIRDS MOBILE VINTAGE DESIGN","5.95",100000
"22321",1,"BIRD DECORATION RED RETROSPOT","BIRD DECORATION RED RETROSPOT","0.85",100000
"22322",1,"BIRD DECORATION GREEN POLKADOT","BIRD DECORATION GREEN POLKADOT","1.63",100000
"22323",1,"PINK POLKADOT KIDS BAG","PINK POLKADOT KIDS BAG","0.00",100000
"22324",1,"BLUE POLKADOT KIDS BAG","BLUE POLKADOT KIDS BAG","4.13",100000
"22325",1,"MOBILE VINTAGE HEARTS ","MOBILE VINTAGE HEARTS ","4.95",100000
"22326",1,"ROUND SNACK BOXES SET OF4 WOODLAND ","ROUND SNACK BOXES SET OF4 WOODLAND ","5.79",100000
"22327",1,"ROUND SNACK BOXES SET OF 4 SKULLS","ROUND SNACK BOXES SET OF 4 SKULLS","2.95",100000
"22328",1,"ROUND SNACK BOXES SET OF 4 FRUITS ","ROUND SNACK BOXES SET OF 4 FRUITS ","2.95",100000
"22329",1,"ROUND CONTAINER SET OF 5 RETROSPOT","ROUND CONTAINER SET OF 5 RETROSPOT","3.29",100000
"22330",1,"72 ROUND PINK DOILIES","72 ROUND PINK DOILIES","1.45",100000
