"ProductId","CategoryId","ProductName","ProductDescription","ProductPrice","ProductQuantity"
"79190D",1,"RETRO PLASTIC DAISY TRAY","RETRO PLASTIC DAISY TRAY","0.42",100000
"79191B",1,"RETRO PLASTIC POLKA TRAY","RETRO PLASTIC POLKA TRAY","1.63",100000
"79191C",1,"RETRO PLASTIC ELEPHANT TRAY","RETRO PLASTIC ELEPHANT TRAY","0.85",100000
"79191D",1,"RETRO PLASTIC DAISY TRAY","RETRO PLASTIC DAISY TRAY","1.63",100000
"79192A",1,"RETRO PLASTIC 70'S TRAY","RETRO PLASTIC 70'S TRAY","1.25",100000
"79301",1,"FEATHER HEART LIGHTS","FEATHER HEART LIGHTS","2.55",100000
"79302M",1,"ART LIGHTS,FUNK MONKEY","ART LIGHTS,FUNK MONKEY","5.79",100000
"79303A",1,"WHITE ROHMBIC BLOCK TABLE LAMP","WHITE ROHMBIC BLOCK TABLE LAMP","0.00",100000
"79303B",1,"BLUE STAR BLOCK TABLE LAMP","BLUE STAR BLOCK TABLE LAMP","2.95",100000
"79303D",1,"LILAC FLOWER BLOCK TABLE LAMP","LILAC FLOWER BLOCK TABLE LAMP","2.95",100000
"79308B",1,"MOSAIC CANDLE DISH BLUE PURPLE","MOSAIC CANDLE DISH BLUE PURPLE","0.85",100000
"79315W",1,"FLYING SAUCER TABLE LIGHT IN WHITE","FLYING SAUCER TABLE LIGHT IN WHITE","2.95",100000
"79320",1,"FLAMINGO LIGHTS","FLAMINGO LIGHTS","4.95",100000
"79321",1,"CHILLI LIGHTS","CHILLI LIGHTS","12.46",100000
"79323B",1,"BLACK CHERRY LIGHTS","BLACK CHERRY LIGHTS","6.75",100000
"79323G",1,"GOLD  CHERRY LIGHTS","GOLD  CHERRY LIGHTS","6.75",100000
"79323GR",1,"GREEN CHERRY LIGHTS","GREEN CHERRY LIGHTS","6.75",100000
"79323LP",1,"LIGHT PINK CHERRY LIGHTS","LIGHT PINK CHERRY LIGHTS","6.75",100000
"79323P",1,"PINK CHERRY LIGHTS","PINK CHERRY LIGHTS","6.75",100000
"79323S",1,"SILVER CHERRY LIGHTS","SILVER CHERRY LIGHTS","5.45",100000
"79323W",1,"WHITE CHERRY LIGHTS","WHITE CHERRY LIGHTS","6.75",100000
"79328",1,"BLUE FLOCK GLASS CANDLEHOLDER","BLUE FLOCK GLASS CANDLEHOLDER","3.36",100000
"79329",1,"PINK FLOCK GLASS CANDLEHOLDER","PINK FLOCK GLASS CANDLEHOLDER","0.38",100000
"79331",1,"PINK FLOCK GLASS CANDLEHOLDER","PINK FLOCK GLASS CANDLEHOLDER","0.38",100000
"79336",1,"LIGHT PINK FLOCK GLASS CANDLEHOLDER","LIGHT PINK FLOCK GLASS CANDLEHOLDER","0.38",100000
"79337",1,"BLUE FLOCK GLASS CANDLEHOLDER","BLUE FLOCK GLASS CANDLEHOLDER","0.00",100000
"79338",1,"DARK PINK FLOCK GLASS CANDLEHOLDER","DARK PINK FLOCK GLASS CANDLEHOLDER","1.65",100000
"79340P",1,"PURPLE ORCHID FLOWER LIGHTS","PURPLE ORCHID FLOWER LIGHTS","7.95",100000
"79340W",1,"WHITE ORCHID FLOWER LIGHTS","WHITE ORCHID FLOWER LIGHTS","6.75",100000
"79341",1,"WILLOW BRANCH LIGHTS.","WILLOW BRANCH LIGHTS.","6.75",100000
"79342B",1,"BROWN FLOWER LIGHTS","BROWN FLOWER LIGHTS","5.45",100000
"79403",1,"FROSTED WHITE BASE ","FROSTED WHITE BASE ","0.85",100000
"79406",1,"FROSTED WHITE BASE ","FROSTED WHITE BASE ","0.22",100000
"79413",1,"GLASS WINE GLASS DECORATIONS","GLASS WINE GLASS DECORATIONS","1.25",100000
"79532",1,"MOSAIC GLASS BALL CANDLEHOLDER","MOSAIC GLASS BALL CANDLEHOLDER","1.25",100000
"79534",1,"MULTICOLOUR GLASS PLATE","MULTICOLOUR GLASS PLATE","0.00",100000
"81950B",1,"FLOWER BLUE CLOCK WITH SUCKER","FLOWER BLUE CLOCK WITH SUCKER","0.29",100000
"81950V",1,"FLOWER PURPLE CLOCK WITH SUCKER","FLOWER PURPLE CLOCK WITH SUCKER","0.29",100000
"81952B",1,"ROUND BLUE CLOCK W/SUCKER","ROUND BLUE CLOCK W/SUCKER","0.00",100000
"81952V",1,"ROUND PURPLE CLOCK WITH SUCKER","ROUND PURPLE CLOCK WITH SUCKER","0.19",100000
"81953B",1,"ROUND BLUE CLOCK WITH SUCKER","ROUND BLUE CLOCK WITH SUCKER","0.19",100000
"81953P",1,"ROUND ARTICULATED PINK CLOCK W/SUCK","ROUND ARTICULATED PINK CLOCK W/SUCK","0.19",100000
"81985A",1,"ICON ALARM CLOCK,FUSCHIA  PIN UP","ICON ALARM CLOCK,FUSCHIA  PIN UP","2.55",100000
"82001S",1,"SILVER RECORD COVER FRAME","SILVER RECORD COVER FRAME","7.46",100000
"82011A",1,"BATHROOM SCALES, TROPICAL BEACH","BATHROOM SCALES, TROPICAL BEACH","3.75",100000
"82011B",1,"BATHROOM SCALES RUBBER DUCKS","BATHROOM SCALES RUBBER DUCKS","2.95",100000
"82011C",1,"BATHROOM SCALES FOOTPRINTS IN SAND","BATHROOM SCALES FOOTPRINTS IN SAND","2.95",100000
"82011E",1,"BATHROOM SCALES, FAG BREAK","BATHROOM SCALES, FAG BREAK","3.75",100000
"82069",1,"BEECH WOOD P/FRAME","BEECH WOOD P/FRAME","5.91",100000
"82072",1,"WHITE WOOD SINGLE P/FRAME","WHITE WOOD SINGLE P/FRAME","1.25",100000
"82076",1,"BEECH WOOD PHOTO FRAME ","BEECH WOOD PHOTO FRAME ","1.25",100000
"82081",1,"PINK HEARTS PHOTO ALBUM","PINK HEARTS PHOTO ALBUM","1.95",100000
"82093",1,"HEART SHAPE BUTTON FRAME ","HEART SHAPE BUTTON FRAME ","1.25",100000
"82095",1,"HEART BUTTONS JEWELLERY BOX","HEART BUTTONS JEWELLERY BOX","4.96",100000
"82482",1,"WOODEN PICTURE FRAME WHITE FINISH","WOODEN PICTURE FRAME WHITE FINISH","2.95",100000
"82483",1,"WOOD 2 DRAWER CABINET WHITE FINISH","WOOD 2 DRAWER CABINET WHITE FINISH","6.95",100000
"82484",1,"WOOD BLACK BOARD ANT WHITE FINISH","WOOD BLACK BOARD ANT WHITE FINISH","7.95",100000
"82486",1,"3 DRAWER ANTIQUE WHITE WOOD CABINET","3 DRAWER ANTIQUE WHITE WOOD CABINET","8.95",100000
"82494L",1,"WOODEN FRAME ANTIQUE WHITE ","WOODEN FRAME ANTIQUE WHITE ","2.95",100000
"82545A",1,"COGNAC AUX OEUFS METAL 1 HOOK","COGNAC AUX OEUFS METAL 1 HOOK","1.25",100000
"82551",1,"LAUNDRY 15C METAL SIGN","LAUNDRY 15C METAL SIGN","1.45",100000
"82552",1,"WASHROOM METAL SIGN","WASHROOM METAL SIGN","1.45",100000
"82553",1,"POP'S GREASY SPOON METAL SIGN","POP'S GREASY SPOON METAL SIGN","0.00",100000
"82567",1,"AIRLINE LOUNGE,METAL SIGN","AIRLINE LOUNGE,METAL SIGN","2.10",100000
"82578",1,"KITCHEN METAL SIGN","KITCHEN METAL SIGN","0.55",100000
"82580",1,"BATHROOM METAL SIGN","BATHROOM METAL SIGN","1.25",100000
"82581",1,"TOILET METAL SIGN","TOILET METAL SIGN","0.55",100000
"82582",1,"AREA PATROLLED METAL SIGN","AREA PATROLLED METAL SIGN","2.10",100000
"82583",1,"HOT BATHS METAL SIGN","HOT BATHS METAL SIGN","2.10",100000
"82585",1,"SWEET VALENCIA CANDLE+CUP","SWEET VALENCIA CANDLE+CUP","1.25",100000
"82587",1,"TEXRIO TOMATOES CANDLE+CUP","TEXRIO TOMATOES CANDLE+CUP","1.25",100000
"82597",1,"BOMBS AWAY METAL SIGN","BOMBS AWAY METAL SIGN","0.00",100000
"82599",1,"FANNY'S REST STOPMETAL SIGN","FANNY'S REST STOPMETAL SIGN","0.00",100000
"82600",1,"N0 SINGING METAL SIGN","N0 SINGING METAL SIGN","2.10",100000
"82605",1,"OLD DOC.RUSSEL METAL SIGN","OLD DOC.RUSSEL METAL SIGN","0.00",100000
"82607A",1,"GLASS BONBON JAR PARFUME AUX FLEURE","GLASS BONBON JAR PARFUME AUX FLEURE","0.00",100000
"82607C",1,"GLASS BONBON JAR. SUPERFINES","GLASS BONBON JAR. SUPERFINES","2.51",100000
"82607E",1,"GLASS BONBON JAR. D'AMANDES","GLASS BONBON JAR. D'AMANDES","1.25",100000
"82613A",1,"Amazon","Amazon","0.00",100000
"82613B",1,"METAL SIGN,CUPCAKE SINGLE HOOK","METAL SIGN,CUPCAKE SINGLE HOOK","2.46",100000
"82613C",1,"METAL SIGN,CUPCAKE SINGLE HOOK","METAL SIGN,CUPCAKE SINGLE HOOK","2.46",100000
"82613D",1,"METAL SIGN CUPCAKE SINGLE HOOK","METAL SIGN CUPCAKE SINGLE HOOK","1.25",100000
"82615",1,"PINK MARSHMALLOW SCARF KNITTING KIT","PINK MARSHMALLOW SCARF KNITTING KIT","2.55",100000
"82616A",1,"BUBBLE GUM SCARF KNITTING KIT","BUBBLE GUM SCARF KNITTING KIT","2.95",100000
"82616B",1,"FRAPPUCINO SCARF KNITTING KIT","FRAPPUCINO SCARF KNITTING KIT","2.46",100000
"82616C",1,"MIDNIGHT GLAMOUR SCARF KNITTING KIT","MIDNIGHT GLAMOUR SCARF KNITTING KIT","2.46",100000
"84006",1,"MAGIC TREE -PAPER FLOWERS","MAGIC TREE -PAPER FLOWERS","0.85",100000
"84007",1,"MAGIC GARDEN MOUNT FUJI","MAGIC GARDEN MOUNT FUJI","2.55",100000
"84012",1,"MAGIC SHEEP WOOL GROWING FROM PAPER","MAGIC SHEEP WOOL GROWING FROM PAPER","0.85",100000
"84016",1,"FLAG OF ST GEORGE CAR FLAG","FLAG OF ST GEORGE CAR FLAG","0.42",100000
"84029C",1,"BROWN FURRY HOT WATER BOTTLE","BROWN FURRY HOT WATER BOTTLE","3.75",100000
"84029D",1,"LEOPARD PRINT HOT WATER BOTTLE","LEOPARD PRINT HOT WATER BOTTLE","3.75",100000
"84029E",1,"RED WOOLLY HOTTIE WHITE HEART.","RED WOOLLY HOTTIE WHITE HEART.","4.25",100000
"84029G",1,"KNITTED UNION FLAG HOT WATER BOTTLE","KNITTED UNION FLAG HOT WATER BOTTLE","3.75",100000
"84030B",1,"KNITTED POM POM HOT WATER BOTTLE","KNITTED POM POM HOT WATER BOTTLE","0.00",100000
"84030C",1,"KNITTED RAINBOW HOT WATER BOTTLE","KNITTED RAINBOW HOT WATER BOTTLE","0.00",100000
"84030E",1,"ENGLISH ROSE HOT WATER BOTTLE","ENGLISH ROSE HOT WATER BOTTLE","4.25",100000
"84031A",1,"CHARLIE+LOLA RED HOT WATER BOTTLE ","CHARLIE+LOLA RED HOT WATER BOTTLE ","1.25",100000
"84031B",1,"CHARLIE LOLA BLUE HOT WATER BOTTLE ","CHARLIE LOLA BLUE HOT WATER BOTTLE ","4.13",100000
"84032A",1,"CHARLIE+LOLA PINK HOT WATER BOTTLE","CHARLIE+LOLA PINK HOT WATER BOTTLE","3.29",100000
"84032B",1,"CHARLIE + LOLA RED HOT WATER BOTTLE","CHARLIE + LOLA RED HOT WATER BOTTLE","0.79",100000
"84033",1,"FLAG OF ST GEORGE ","FLAG OF ST GEORGE ","1.65",100000
"84050",1,"check","check","0.00",100000
"84051",1,"ASS COLOUR GLOWING TIARAS","ASS COLOUR GLOWING TIARAS","0.85",100000
"84077",1,"WORLD WAR 2 GLIDERS ASSTD DESIGNS","WORLD WAR 2 GLIDERS ASSTD DESIGNS","0.29",100000
"84078A",1,"SET/4 WHITE RETRO STORAGE CUBES ","SET/4 WHITE RETRO STORAGE CUBES ","39.95",100000
"84081",1,"WHITE CERAMIC PARTY SET (5PCS)","WHITE CERAMIC PARTY SET (5PCS)","4.25",100000
"84086B",1,"YELLOW/BLUE RETRO RADIO","YELLOW/BLUE RETRO RADIO","2.95",100000
"84086C",1,"PINK/PURPLE RETRO RADIO","PINK/PURPLE RETRO RADIO","2.95",100000
"84192",1,"ASSORTED COLOUR METAL CAT ","ASSORTED COLOUR METAL CAT ","1.25",100000
"84199",1,"GLOW IN DARK DOLPHINS","GLOW IN DARK DOLPHINS","0.21",100000
"84201B",1,"HAPPY BIRTHDAY CARD STRIPEY TEDDY","HAPPY BIRTHDAY CARD STRIPEY TEDDY","0.19",100000
"84201C",1,"HAPPY BIRTHDAY CARD TEDDY/CAKE","HAPPY BIRTHDAY CARD TEDDY/CAKE","0.19",100000
"84205C",1,"HAPPY BIRTHDAY GINGER CAT CARD","HAPPY BIRTHDAY GINGER CAT CARD","0.19",100000
"84206A",1,"3 BLACK CATS W HEARTS BLANK CARD","3 BLACK CATS W HEARTS BLANK CARD","0.19",100000
"84206B",1,"CAT WITH SUNGLASSES BLANK CARD","CAT WITH SUNGLASSES BLANK CARD","0.19",100000
"84206C",1,"CHAMPAGNE TRAY BLANK CARD","CHAMPAGNE TRAY BLANK CARD","0.19",100000
"84212",1,"ASSORTED FLOWER COLOUR ""LEIS""","ASSORTED FLOWER COLOUR ""LEIS""","0.42",100000
"84218",1,"BOX/12 CHICK & EGG IN BASKET","BOX/12 CHICK & EGG IN BASKET","1.95",100000
"84219",1,"BOX/12 MOTHER & CHICK IN BASKET/BOW","BOX/12 MOTHER & CHICK IN BASKET/BOW","0.00",100000
"84226",1,"HEN HOUSE W FAMILY IN BARN & NEST","HEN HOUSE W FAMILY IN BARN & NEST","0.64",100000
"84227",1,"HEN HOUSE W CHICK IN NEST","HEN HOUSE W CHICK IN NEST","0.00",100000
"84228",1,"HEN HOUSE WITH CHICK STANDING","HEN HOUSE WITH CHICK STANDING","0.42",100000
"84231",1,"EASTER BUNNY WITH BASKET ON BACK","EASTER BUNNY WITH BASKET ON BACK","0.65",100000
"84247C",1,"PACK/12 BLUE REINDEER CARD","PACK/12 BLUE REINDEER CARD","0.00",100000
"84247E",1,"PACK OF 12 CHRISTMAS FUN CARDS","PACK OF 12 CHRISTMAS FUN CARDS","2.95",100000
"84247G",1,"DECOUPAGE,GREETING CARD,","DECOUPAGE,GREETING CARD,","0.42",100000
"84247H",1,"PACK/12 DECOUPAGE CARD","PACK/12 DECOUPAGE CARD","2.95",100000
"84247J",1,"PACK/12 RUSSIAN DOLL CARDS","PACK/12 RUSSIAN DOLL CARDS","0.86",100000
"84247K",1,"FOLK ART GREETING CARD,pack/12","FOLK ART GREETING CARD,pack/12","2.95",100000
"84247L",1,"FAWN AND MUSHROOM GREETING CARD","FAWN AND MUSHROOM GREETING CARD","0.83",100000
"84247N",1,"PACK/12 BLUE FOLKART CARDS","PACK/12 BLUE FOLKART CARDS","2.95",100000
"84249A",1,"GREETING CARD,SQUARE, DOUGHNUTS","GREETING CARD,SQUARE, DOUGHNUTS","0.83",100000
"84249D",1,"FAIRY CAKE GREETINGS CARD","FAIRY CAKE GREETINGS CARD","0.42",100000
"84250M",1,"GREETING CARD, BLACKPOOL ROCK","GREETING CARD, BLACKPOOL ROCK","0.85",100000
"84251B",1,"GREETING CARD, STICKY GORDON","GREETING CARD, STICKY GORDON","0.19",100000
"84251C",1,"GREETING CARD, TWO SISTERS.","GREETING CARD, TWO SISTERS.","0.83",100000
"84251F",1,"GREETING CARD, RITA","GREETING CARD, RITA","0.00",100000
"84251G",1,"GREETING CARD, OVERCROWDED POOL.","GREETING CARD, OVERCROWDED POOL.","0.19",100000
"84251J",1,"GREETING CARD, THE BLACK CAT","GREETING CARD, THE BLACK CAT","0.84",100000
"84255A",1,"PINK GLASS COCKTAIL LAMP","PINK GLASS COCKTAIL LAMP","0.00",100000
"84255B",1,"ORANGE COCKTAIL GLASS LAMP","ORANGE COCKTAIL GLASS LAMP","2.10",100000
"84270",1,"ASSTD DESIGN BUBBLE GUM RING","ASSTD DESIGN BUBBLE GUM RING","0.00",100000
"84279B",1,"CHERRY BLOSSOM DECORATIVE FLASK","CHERRY BLOSSOM DECORATIVE FLASK","3.75",100000
"84279P",1,"CHERRY BLOSSOM  DECORATIVE FLASK","CHERRY BLOSSOM  DECORATIVE FLASK","8.29",100000
"84288B",1,"SET/2 BLUE  NOODLE BASKETS","SET/2 BLUE  NOODLE BASKETS","1.95",100000
"84292",1,"ROSE PINK METAL FOLDING CHAIR","ROSE PINK METAL FOLDING CHAIR","7.95",100000
"84292B",1,"BLUE COL METAL FOLDING CHAIR","BLUE COL METAL FOLDING CHAIR","0.00",100000
"84306",1,"S/3 PINK SQUARE PLANTERS ROSES","S/3 PINK SQUARE PLANTERS ROSES","8.29",100000
"84311",1,"CAMOFLAGE CUSHION COVER","CAMOFLAGE CUSHION COVER","1.65",100000
"84313A",1,"PINK TV TRAY TABLE ","PINK TV TRAY TABLE ","4.25",100000
"84313B",1,"BLUE TV TRAY TABLE ","BLUE TV TRAY TABLE ","1.95",100000
"84313C",1,"ORANGE TV TRAY TABLE ","ORANGE TV TRAY TABLE ","1.95",100000
"84327A",1,"PINK JUMPER LARRY THE LAMB","PINK JUMPER LARRY THE LAMB","2.10",100000
"84340",1,"LARGE FIBRE OPTIC CHRISTMAS TREE","LARGE FIBRE OPTIC CHRISTMAS TREE","7.78",100000
"84341B",1,"SMALL PINK MAGIC CHRISTMAS TREE","SMALL PINK MAGIC CHRISTMAS TREE","0.38",100000
"84347",1,"ROTATING SILVER ANGELS T-LIGHT HLDR","ROTATING SILVER ANGELS T-LIGHT HLDR","2.55",100000
"84352",1,"SILVER CHRISTMAS TREE BAUBLE STAND ","SILVER CHRISTMAS TREE BAUBLE STAND ","16.95",100000
"84356",1,"POMPOM CURTAIN","POMPOM CURTAIN","1.95",100000
"84358",1,"FLOOR LAMP SHADE WOOD BASE","FLOOR LAMP SHADE WOOD BASE","8.49",100000
"84360",1,"TABLE LAMP WHITE SHADE WOOD BASE","TABLE LAMP WHITE SHADE WOOD BASE","5.95",100000
"84366",1,"VENDETTA CANVAS PICTURE","VENDETTA CANVAS PICTURE","3.75",100000
"84367",1,"LA STREGA CANVAS PICTURE ","LA STREGA CANVAS PICTURE ","1.65",100000
"84371",1,"BIG PINK POODLE","BIG PINK POODLE","5.00",100000
"84375",1,"SET OF 20 KIDS COOKIE CUTTERS","SET OF 20 KIDS COOKIE CUTTERS","2.10",100000
"84378",1,"SET OF 3 HEART COOKIE CUTTERS","SET OF 3 HEART COOKIE CUTTERS","1.45",100000
"84380",1,"SET OF 3 BUTTERFLY COOKIE CUTTERS","SET OF 3 BUTTERFLY COOKIE CUTTERS","1.45",100000
"84387A",1,"BIRD ON BRANCH CANVAS SCREEN","BIRD ON BRANCH CANVAS SCREEN","1.95",100000
"84388",1,"WISE MAN STAR SHAPE EGG PAN","WISE MAN STAR SHAPE EGG PAN","0.00",100000
"84396",1,"6 HOOK JEWELLERY STAND BLACK DRESS","6 HOOK JEWELLERY STAND BLACK DRESS","1.95",100000
"84402B",1,"PURPLE DRESS JEWELLERY STAND","PURPLE DRESS JEWELLERY STAND","0.00",100000
"84402D",1,"PINK DRESS JEWELLERY STAND ","PINK DRESS JEWELLERY STAND ","0.00",100000
"84405A",1,"S/3 PINK COL METAL BASKET W HANDLE","S/3 PINK COL METAL BASKET W HANDLE","12.75",100000
"84406B",1,"CREAM CUPID HEARTS COAT HANGER","CREAM CUPID HEARTS COAT HANGER","4.15",100000
"84414B",1,"FUSCHIA/GREEN STRIPE WOOLLY BLANKET","FUSCHIA/GREEN STRIPE WOOLLY BLANKET","5.95",100000
"84415A",1,"PINK FLOCK SUEDE CUSHION COVER ","PINK FLOCK SUEDE CUSHION COVER ","1.25",100000
"84415B",1,"BLUE FLOCK CUSHION COVER ","BLUE FLOCK CUSHION COVER ","1.25",100000
"84422",1,"PINK/BLUE DISC/MIRROR STRING","PINK/BLUE DISC/MIRROR STRING","0.39",100000
"84424A",1,"FOUR PICTURE WHITE GLASS FRAME","FOUR PICTURE WHITE GLASS FRAME","3.75",100000
"84425A",1,"WHITE GLASS TV TRIPLE FRAME","WHITE GLASS TV TRIPLE FRAME","4.25",100000
"84427B",1,"BLACK GLASS TV DOUBLE P/FRAME 15X10","BLACK GLASS TV DOUBLE P/FRAME 15X10","0.00",100000
"84429A",1,"MEDIUM PINK BUDDHA HEAD ","MEDIUM PINK BUDDHA HEAD ","2.95",100000
"84437A",1,"S/6 PINK EASTER DECS IN BOX","S/6 PINK EASTER DECS IN BOX","0.85",100000
"84447",1,"6 RABBIT CHAIN EASTER","6 RABBIT CHAIN EASTER","0.00",100000
"84450A",1,"PINK RABBIT SITTING EASTER","PINK RABBIT SITTING EASTER","0.00",100000
"84450B",1,"PINK/YELLOW RABBIT SAT EASTER","PINK/YELLOW RABBIT SAT EASTER","0.81",100000
"84452",1,"METAL RABBIT LADDER EASTER ","METAL RABBIT LADDER EASTER ","0.85",100000
"84454",1,"WOBBLING METAL CHICKEN EASTER","WOBBLING METAL CHICKEN EASTER","0.85",100000
"84455",1,"SET OF 3 RABBIT CARROTS EASTER","SET OF 3 RABBIT CARROTS EASTER","0.85",100000
"84456",1,"SET OF 3 RABBIT EGG EASTER","SET OF 3 RABBIT EGG EASTER","0.85",100000
"84457",1,"SET/3 RABBITS FLOWER SKIPPPING ROPE","SET/3 RABBITS FLOWER SKIPPPING ROPE","0.85",100000
"84458",1,"S/3 RABBIT FLOWER/EGG/CARROT ROPE","S/3 RABBIT FLOWER/EGG/CARROT ROPE","0.85",100000
"84459A",1,"PINK METAL CHICKEN HEART ","PINK METAL CHICKEN HEART ","1.49",100000
"84459B",1,"YELLOW METAL CHICKEN HEART ","YELLOW METAL CHICKEN HEART ","0.00",100000
"84461",1,"12 PINK HEN+CHICKS IN BASKET","12 PINK HEN+CHICKS IN BASKET","2.55",100000
"84462",1,"3 PINK HEN+CHICKS IN BASKET","3 PINK HEN+CHICKS IN BASKET","1.25",100000
"84464",1,"S/60 PINK FLUFFY CHICKS IN BOX","S/60 PINK FLUFFY CHICKS IN BOX","0.00",100000
"84465",1,"15 PINK FLUFFY CHICKS IN BOX","15 PINK FLUFFY CHICKS IN BOX","2.95",100000
"84466",1,"TOP SECRET PEN SET","TOP SECRET PEN SET","1.25",100000
"84467",1,"ENGLISH ROSE DESIGN QUILTED THROW","ENGLISH ROSE DESIGN QUILTED THROW","10.00",100000
"84469",1,"ROSE DES PADDED FLOOR CUSHION","ROSE DES PADDED FLOOR CUSHION","0.00",100000
"84472",1,"PINK AND LILAC QUILTED THROW ","PINK AND LILAC QUILTED THROW ","45.95",100000
"84482",1,"BUTTONS DESIGN JEWELLERY BOX","BUTTONS DESIGN JEWELLERY BOX","3.75",100000
"84493",1,"BLUE/PINK NEST STRIPE BOX","BLUE/PINK NEST STRIPE BOX","0.08",100000
"84497",1,"BUTTONS AND STRIPES NOTEBOOK ","BUTTONS AND STRIPES NOTEBOOK ","3.75",100000
"84499",1,"BLACK FLOWER CANDLE PLATE","BLACK FLOWER CANDLE PLATE","0.85",100000
"84507B",1,"STRIPES DESIGN MONKEY DOLL","STRIPES DESIGN MONKEY DOLL","2.55",100000
"84507C",1,"adjustment","adjustment","0.00",100000
"84508A",1,"CAMOUFLAGE DESIGN TEDDY","CAMOUFLAGE DESIGN TEDDY","2.10",100000
"84508B",1,"STRIPES DESIGN TEDDY","STRIPES DESIGN TEDDY","2.55",100000
"84508C",1,"BLUE CIRCLES DESIGN TEDDY","BLUE CIRCLES DESIGN TEDDY","2.55",100000
"84509A",1,"SET OF 4 ENGLISH ROSE PLACEMATS","SET OF 4 ENGLISH ROSE PLACEMATS","7.46",100000
"84509B",1,"SET OF 4 FAIRY CAKE PLACEMATS","SET OF 4 FAIRY CAKE PLACEMATS","3.75",100000
"84509C",1,"SET OF 4 POLKADOT PLACEMATS ","SET OF 4 POLKADOT PLACEMATS ","7.46",100000
"84509E",1,"SET OF 4 CAROUSEL PLACEMATS ","SET OF 4 CAROUSEL PLACEMATS ","3.75",100000
"84509F",1,"SET OF 4 NEW ENGLAND PLACEMATS","SET OF 4 NEW ENGLAND PLACEMATS","3.75",100000
"84509G",1,"SET OF 4 FAIRY CAKE PLACEMATS ","SET OF 4 FAIRY CAKE PLACEMATS ","1.25",100000
"84510A",1,"SET OF 4 ENGLISH ROSE COASTERS","SET OF 4 ENGLISH ROSE COASTERS","1.25",100000
"84510B",1,"SET OF 4 FAIRY CAKES COASTERS ","SET OF 4 FAIRY CAKES COASTERS ","0.00",100000
"84510C",1,"SET OF 4 POLKADOT COASTERS","SET OF 4 POLKADOT COASTERS","1.25",100000
"84510E",1,"SET OF 4 GREEN CAROUSEL COASTERS","SET OF 4 GREEN CAROUSEL COASTERS","1.25",100000
"84510F",1,"SET OF 4 NEW ENGLAND COASTERS ","SET OF 4 NEW ENGLAND COASTERS ","1.25",100000
"84519A",1,"TOMATO CHARLIE+LOLA COASTER SET","TOMATO CHARLIE+LOLA COASTER SET","5.79",100000
"84519B",1,"CARROT CHARLIE+LOLA COASTER SET","CARROT CHARLIE+LOLA COASTER SET","1.25",100000
"84520B",1,"PACK 20 ENGLISH ROSE PAPER NAPKINS","PACK 20 ENGLISH ROSE PAPER NAPKINS","1.63",100000
"84520D",1,"PACK OF 20 FAIRY CAKE PAPER NAPKINS","PACK OF 20 FAIRY CAKE PAPER NAPKINS","0.00",100000
"84522",1,"PINK PARTY SUNGLASSES","PINK PARTY SUNGLASSES","1.95",100000
"84526",1,"GIANT BLACK SUNGLASSES","GIANT BLACK SUNGLASSES","1.95",100000
"84527",1,"FLAMES SUNGLASSES PINK LENSES","FLAMES SUNGLASSES PINK LENSES","1.95",100000
"84529A",1,"PINK KNITTED KIDS RUCKSACK","PINK KNITTED KIDS RUCKSACK","0.00",100000
"84529B",1,"BLUE KNITTED KID'S RUCKSACK","BLUE KNITTED KID'S RUCKSACK","4.21",100000
"84529C",1,"YELLOW KNITTED KIDS RUCKSACK","YELLOW KNITTED KIDS RUCKSACK","4.21",100000
"84531A",1,"returned","returned","0.00",100000
"84531B",1,"returned","returned","0.00",100000
"84532B",1,"FAIRY CAKES RECTANGLUAR BOXES","FAIRY CAKES RECTANGLUAR BOXES","5.95",100000
"84533B",1,"FAIRY CAKES ROUND NESTING BOXES","FAIRY CAKES ROUND NESTING BOXES","11.87",100000
"84534B",1,"FAIRY CAKE NOTEBOOK A5 SIZE","FAIRY CAKE NOTEBOOK A5 SIZE","0.85",100000
"84535A",1,"ENGLISH ROSE NOTEBOOK A6 SIZE","ENGLISH ROSE NOTEBOOK A6 SIZE","0.65",100000
"84535B",1,"FAIRY CAKES NOTEBOOK A6 SIZE","FAIRY CAKES NOTEBOOK A6 SIZE","0.65",100000
"84536A",1,"ENGLISH ROSE NOTEBOOK A7 SIZE","ENGLISH ROSE NOTEBOOK A7 SIZE","0.42",100000
"84536B",1,"FAIRY CAKES NOTEBOOK A7 SIZE","FAIRY CAKES NOTEBOOK A7 SIZE","0.83",100000
"84537B",1,"FAIRY CAKES GIFT BAG","FAIRY CAKES GIFT BAG","0.42",100000
"84539",1,"KNITTED RABBIT DOLL ","KNITTED RABBIT DOLL ","1.65",100000
"84546",1,"CROCHET POODLE KEYRING","CROCHET POODLE KEYRING","1.65",100000
"84548",1,"CROCHET BEAR RED/BLUE  KEYRING","CROCHET BEAR RED/BLUE  KEYRING","1.65",100000
"84549",1,"CROCHET WHITE RABBIT KEYRING ","CROCHET WHITE RABBIT KEYRING ","3.29",100000
"84550",1,"CROCHET LILAC/RED BEAR KEYRING","CROCHET LILAC/RED BEAR KEYRING","1.65",100000
"84551",1,"CROCHET DOG KEYRING","CROCHET DOG KEYRING","1.65",100000
"84555A",1,"YELLOW VW BEETLE CERAMIC MONEY BOX","YELLOW VW BEETLE CERAMIC MONEY BOX","2.95",100000
"84558A",1,"3D DOG PICTURE PLAYING CARDS","3D DOG PICTURE PLAYING CARDS","5.79",100000
"84559A",1,"3D SHEET OF DOG STICKERS","3D SHEET OF DOG STICKERS","1.63",100000
"84559B",1,"3D SHEET OF CAT STICKERS","3D SHEET OF CAT STICKERS","0.85",100000
"84559D",1,"3D SHEET OF SEA WORLD STICKERS","3D SHEET OF SEA WORLD STICKERS","0.85",100000
"84562A",1,"PINK/WHITE RIBBED MELAMINE JUG","PINK/WHITE RIBBED MELAMINE JUG","7.95",100000
"84562B",1,"BLUE/WHITE RIBBED MELAMINE JUG","BLUE/WHITE RIBBED MELAMINE JUG","16.98",100000
"84563A",1,"PINK & WHITE BREAKFAST TRAY","PINK & WHITE BREAKFAST TRAY","2.95",100000
"84563B",1,"BLUE & WHITE BREAKFAST TRAY","BLUE & WHITE BREAKFAST TRAY","2.95",100000
"84564",1,"6 SEGMENT COLOURED SNACK BOWL ","6 SEGMENT COLOURED SNACK BOWL ","7.95",100000
"84567",1,"FROSTED GLASS WITH SILVER SURROUND","FROSTED GLASS WITH SILVER SURROUND","1.65",100000
"84568",1,"GIRLS ALPHABET IRON ON PATCHES ","GIRLS ALPHABET IRON ON PATCHES ","0.42",100000
"84569A",1,"PACK 3 IRON ON DOG PATCHES","PACK 3 IRON ON DOG PATCHES","2.46",100000
"84569B",1,"PACK 3 FIRE ENGINE/CAR PATCHES","PACK 3 FIRE ENGINE/CAR PATCHES","2.46",100000
"84569C",1,"PACK 4 FLOWER/BUTTERFLY PATCHES","PACK 4 FLOWER/BUTTERFLY PATCHES","1.25",100000
"84569D",1,"PACK 6 HEART/ICE-CREAM PATCHES","PACK 6 HEART/ICE-CREAM PATCHES","2.46",100000
"84570B",1,"WHITE SATIN DRESS JEWEL STAND","WHITE SATIN DRESS JEWEL STAND","4.95",100000
"84572",1,"6 HOOK JEWEL STAND LILAC DRESS","6 HOOK JEWEL STAND LILAC DRESS","8.49",100000
"84575A",1,"PINK DOG CANNISTER","PINK DOG CANNISTER","1.95",100000
"84575B",1,"BROWN DOG CANNISTER W BONE","BROWN DOG CANNISTER W BONE","0.00",100000
"84576",1,"BLUE CAT BISCUIT BARREL PINK HEART","BLUE CAT BISCUIT BARREL PINK HEART","1.95",100000
"84578",1,"ELEPHANT TOY WITH BLUE T-SHIRT","ELEPHANT TOY WITH BLUE T-SHIRT","3.75",100000
"84580",1,"MOUSE TOY WITH PINK T-SHIRT","MOUSE TOY WITH PINK T-SHIRT","3.75",100000
"84581",1,"DOG TOY WITH PINK CROCHET SKIRT","DOG TOY WITH PINK CROCHET SKIRT","4.13",100000
"84582",1,"PINK CROCHET CAT WITH SCARF","PINK CROCHET CAT WITH SCARF","4.25",100000
"84584",1,"PINK GINGHAM CAT WITH SCARF","PINK GINGHAM CAT WITH SCARF","2.55",100000
"84586L",1,"PINK ROSES/GINGHAM PATCH RABBIT 8""","PINK ROSES/GINGHAM PATCH RABBIT 8""","2.95",100000
"84592",1,"CROCHET ROSE PURSE WITH SUEDE BACK","CROCHET ROSE PURSE WITH SUEDE BACK","2.95",100000
"84593",1,"CROCHET ROSE DES CLOTHES HANGER","CROCHET ROSE DES CLOTHES HANGER","2.95",100000
"84595B",1,"LARGE TRIFLE DESIGN L BLUE BOWL","LARGE TRIFLE DESIGN L BLUE BOWL","3.75",100000
"84595E",1,"LARGE TORTILLA DESIGN RED BOWL","LARGE TORTILLA DESIGN RED BOWL","3.29",100000
"84596B",1,"SMALL DOLLY MIX DESIGN ORANGE BOWL","SMALL DOLLY MIX DESIGN ORANGE BOWL","0.83",100000
"84596E",1,"SMALL LICORICE DES PINK BOWL","SMALL LICORICE DES PINK BOWL","0.00",100000
"84596F",1,"SMALL MARSHMALLOWS PINK BOWL","SMALL MARSHMALLOWS PINK BOWL","0.83",100000
"84596G",1,"SMALL CHOCOLATES PINK BOWL","SMALL CHOCOLATES PINK BOWL","0.42",100000
"84596I",1,"WRAP SWEETS LIGHT PINK SMALL BOWL","WRAP SWEETS LIGHT PINK SMALL BOWL","1.25",100000
"84596J",1,"MIXED NUTS LIGHT GREEN BOWL","MIXED NUTS LIGHT GREEN BOWL","0.42",100000
"84596K",1,"JELLY BABIES YELLOW SMALL BOWL","JELLY BABIES YELLOW SMALL BOWL","1.25",100000
"84596L",1,"BISCUITS SMALL BOWL LIGHT BLUE","BISCUITS SMALL BOWL LIGHT BLUE","0.42",100000
"84597B",1,"RETRO BROWN BALL ASHTRAY ","RETRO BROWN BALL ASHTRAY ","1.25",100000
"84597C",1,"RETRO PINK BALL ASHTRAY ","RETRO PINK BALL ASHTRAY ","1.25",100000
"84598",1,"BOYS ALPHABET IRON ON PATCHES","BOYS ALPHABET IRON ON PATCHES","0.42",100000
"84599",1,"CANDY STRIPE ROSE FLOOR CUSHION","CANDY STRIPE ROSE FLOOR CUSHION","16.13",100000
"84600",1,"NEW BAROQUE JEWELLERY BOX ","NEW BAROQUE JEWELLERY BOX ","7.95",100000
"84601A",1,"NEW BAROQUE IVORY CUSHION COVER ","NEW BAROQUE IVORY CUSHION COVER ","2.95",100000
"84608",1,"ORNATE EDWARDIAN CANDLE HOLDER","ORNATE EDWARDIAN CANDLE HOLDER","7.95",100000
"84609",1,"TALL ROCOCO CANDLE HOLDER","TALL ROCOCO CANDLE HOLDER","8.50",100000
"84611B",1,"BLACK NEW BAROQUE FLOCK BOX","BLACK NEW BAROQUE FLOCK BOX","0.00",100000
"84612B",1,"SET/4 BLACK  BAROQUE FLOCK COASTER","SET/4 BLACK  BAROQUE FLOCK COASTER","2.55",100000
"84613A",1,"PINK NEW BAROQUE FLOCK CANDLESTICK","PINK NEW BAROQUE FLOCK CANDLESTICK","4.65",100000
"84613C",1,"BLUE NEW BAROQUE FLOCK CANDLESTICK","BLUE NEW BAROQUE FLOCK CANDLESTICK","4.65",100000
"84614A",1,"PINK BAROQUE FLOCK CANDLE HOLDER","PINK BAROQUE FLOCK CANDLE HOLDER","5.95",100000
"84614C",1,"BLUE BAROQUE FLOCK CANDLE HOLDER","BLUE BAROQUE FLOCK CANDLE HOLDER","5.95",100000
"84615",1,"PINK ROUND BUTTERFLY MIRROR ","PINK ROUND BUTTERFLY MIRROR ","1.95",100000
"84616",1,"SILVER ROCCOCO CHANDELIER","SILVER ROCCOCO CHANDELIER","29.95",100000
